In 2008, Brazil failed in the most important tournaments of the season, finishing second in Beijing Olympic Games and fourth in the FIVB World League, which Final Round was played in Rio de Janeiro.	Em 2008, o Brasil fracassou nos torneios mais importantes da temporada, terminando em segundo nos Jogos Olímpicos de Pequim e em quarto na Liga Mundial da FIVB, cuja partida final foi disputada no Rio de Janeiro.
In 2009, however, the coach commanded a renewed team that won the FIVB World League, the FIVB World Grand Championship Cup and the South American Championship.	Em 2009, no entanto, o treinador comandou uma equipe renomada que conquistou a Liga Mundial da FIVB, a Copa dos Campeões do Mundo da FIVB e o Campeonato Sul-americano.
In 2010, Brazil started the season winning the ninth title of the FIVB World League, overcoming the Italian record.	Em 2010, o Brasil começou a temporada conquistando o novo título da Liga Mundial da FIVB, superando o recorde italiano.
In the end of the year, Bernardo his third FIVB World Championship title with Brazil.	No final do ano, Bernardo conquistou o terceiro Campeonato Mundial da FIVB com o Brasil.
In 2011, Rezende led the Brazilian national team winning the silver medal in the FIVB World League, title and the South American Championship.	Em 2011, Rezende liderou a equipe nacional brasileira na conquista da medalha de prata na Liga Mundial da FIVB do título do Campeonato Sul-americano.
In the end of the year, Brazil assured its spot in London Olympic Games by finishing third in the FIVB World Cup.	No final do ano, o Brasil garantiu um lugar nos Jogos Olímpicos de Londres ao terminar em terceiro na Copa do Mundo da FIVB.
Start 2016 with a silver medal in 2016 FIVB World League.	Começou 2016 com uma medalha de prata na Liga Mundial da FIVB de 2016.
Rezende for the fourth time accede in final and winning match final against Italy and won gold medal Rio 2016.	Rezende chegou pela quarta vez à final, enfrentando a Itália, e conquistou a medalha de ouro na Rio 2016.
Since 1999, Rezende is married to volleyball player Fernanda Venturini, with whom he has two daughters.	Desde 1999, Rezende é casado com a jogadora de vôlei Fernanda Venturini, com quem tem duas filhas.
From his previous marriage to player Vera Mossa he had a son who is currently the setter and captain of the Brazilian volleyball team, Bruno Rezende (Bruninho).	Ele teve um filho em seu casamento anterior com a jogadora Vera Mossa, e o rapaz é o atual levantador e capitão da equipe brasileira de vôlei, Bruno Rezende (Bruninho).
In the 16th century, the area of the present district was crossed by the trail connecting the Indian villages of Piratininga and Biacica or Imbiacica (now Itaim Paulista, Vila Curuçá and part of Jardim Helena).	No século 16, a área do bairro atual era cruzada pela trilha que conecta as vilas indígenas de Piratininga e Biacica ou Imbiacica (hoje Itaim Paulista, Vila Curuçá e parte do Jardim Helena).
That trail was also used by the early colonial explorers (bandeirantes).	Essa trilha também era usada pelos primeiros exploradores coloniais (bandeirantes).
Some historians claim that the lands were part of the domain (sesmaria) granted by the Portuguese Crown to João Ramalho.	Alguns historiadores dizem que as terras faziam parte do domínio (sesmaria) concedido pela Coroa portuguesa a João Ramalho.
One of the first permanent residents was in fact the explorer Francisco Velho, who settled along the Aricanduva, on land belonging to Brás Cubas.	Um dos primeiros residentes permanentes era, na verdade, o explorador Francisco Velho, que se acomodou ao longo do Aricanduva, na terra pertencente a Brás Cubas.
Over the following centuries the region became occupied by large farms.	Nos séculos seguintes a região ficou ocupada por grandes fazendas.
The most famous was a property formerly called Tucuri or Bom Retiro, which was acquired in 1865 by Councillor Carrão and then became known as Chácara Carrão.	A mais famosa era um propriedade anteriormente chamada Tucuri ou Bom Retiro, que foi adquirida em 1865 por Councillor Carrão e depois ficou conhecida como Chácara Carrão.
Around the turn of the 20th century, immigrant workers from Portugal, Italy, Spain, and later from Japan came to the area to work at Carrão's farm and at a wool mill, the Lanifícios Minerva S/A, built there in 1906 by Belgian entrepreneurs Paschoal Boronheid and Fernand Delcroix.	Perto do século 20, trabalhadores imigrantes de Portugal, Itália, Espanha e, mais tarde, do Japão vieram para a área para trabalhar na fazenda de Carrão e em uma fábrica de lã, a Lanifícios Minerva S/A, construída em 1906 pelos empreendedores belgas Paschoal Boronheid e Fernand Delcroix.
An urbanized borough, Vila Carrão, was established in 1917.	Um bairro urbanizado, Vila Carrão, foi fundado em 1917.
Another major factor in the area's development was the installation in the 1930s of a large cotton mill, the Cotonifício Guilherme Giorgi, which at its height employed 2800 workers.	Outro grande fator para o desenvolvimento da área foi a instalação nos anos 1930 de uma grande fábrica de lã, a Cotonifício Guilherme Giorgi, que, no auge, empregou 2800 trabalhadores.
The remaining lands of Chácara carrão were urbanized and became the boroughs of Vila Nova Manchester (1922), Vila Santa Isabel (1931), and Jardim Têxtil.	As terras restantes da Chácara Carrão foram urbanizadas e se tornaram distritos da Vila Nova Manchester (1922), Vila Santa Isabel (1931) e Jardim Têxtil.
By the 1950s the area which is now the Carrão district was almost entirely urbanized and integrated with the São Paulo urban area.	Nos anos 1950, a área que hoje é o bairro Carrão foi quase totalmente urbanizada e integrada à área urbana de São Paulo.
The Carrão district was created in 1991 by an act of then mayor Luiza Erundina.	O bairro Carrão foi criado em 1991 por uma ação da então prefeita Luiza Erundina.
Until then, the land was part of the Tatuapé district.	Até então, a área fazia parte do bairro Tatuapé.
It comprises the following neighborhoods: Carrãozinho, Chácara Santo Antonio, Chácara Califórnia, Vila Carrão, Vila Nova Manchester, Vila Santa Isabel, and Vila São Vicente.	Ela abrange os seguintes bairros: Carrãozinho, Chácara Santo Antônio, Chácara Califórnia, Vila Carrão, Vila Nova Manchester, Vila Santa Isabel e Vila São Vicente.
The new district boundaries deviated somewhat from the historical borough boundaries.	Os limites do novo bairro desviam um pouco dos limites históricos do bairro.
In particular, the Carrão metro station, until then part of the Vila Carrão borough, is now in the Tatupé district.	Particularmente, a estação de metrô Carrão, até então parte do bairro  Vila Carrão, hoje faz parte do bairro Tatuapé.
Carrão and the neighboring district of Vila Formosa share the Vila Formosa Cemetery (est.	Carrão e o bairro vizinho de Vila Formosa compartilham o cemitério Vila Formosa (est.
1949).	1949).
It is believed to be the largest cemetery in Latin America, with 780,000 m² and more than 1,400,000 "permanent residents".	Acredita-se ser o maior cemitério na América Latina, com 780.000 m² e mais de 1.400.000 "residentes permanentes".
Floodplain ecosystems such as the Pantanal are defined by their seasonal inundation and desiccation.	Ecossistemas de planícies aluviais, como o Pantanal, são definidas por inundações e dessecamento sazonais.
They shift between phases of standing water and phases of dry soil, when the water table can be well below the root region.	Elas alternam entre fases de água parada e fases de solo seco, quando o lençol d'água pode ficar muito abaixo da região das raízes.
Soils range from high levels of sand in higher areas to higher amounts of clay and silt in riverine areas.	Os solos variam de uma grande quantidade de areia em áreas mais altas a grandes quantidades de argila e sedimentos em áreas ribeirinhas.
Elevation of the Pantanal ranges from 80 to 150 m (260 to 490 ft) above sea level.	A elevação do Pantanal varia de 80 a 150 m (260 a 490 pés) acima do nível do mar. .
Annual rainfall over the flood basin is between 1,000 and 1,500 mm (39 and 59 in), with most rainfall occurring between November and March.	A precipitação anual sobre a área de inundação está entre 1.000 e 1.500 mm (39 e 59 in), sendo que grande parte da precipitação ocorre entre novembro e março.
In the Paraguay River portion of the Pantanal, water levels rise between two meters to five meters seasonally; water fluctuations in other parts of the Pantanal are less than this.	Na parte do Pantanal que abrange o Rio Paraguai, os níveis da água sobem cerca de dois a cinco metros por estação; as flutuações hídricas em outras partes do Pantanal são inferiores a essa.
Flood waters tend to flow slowly (2 to 10 cm (0.79 to 3.94 in) per second) due to the low gradients and high resistance offered by the dense vegetation.	A água de inundação costuma fluir lentamente (2 a 10 cm (0,79 a 3,94 in) por segundo) devido à baixa inclinação e alta resistência oferecida pela vegetação densa.
When rising river waters first contact previously dry soil, the waters become oxygen-depleted, rendering the water environs anoxic.	Quando a água elevada do rio entra em contato pela primeira vez com o solo antes ressecado, ela fica destituída de oxigênio, tornando-a anóxica nas cercanias.
Many natural fish kills can occur if there are no oxygenated water refuges available (the reason for this remains speculative: it may be due to the growth of toxin-producing bacteria in the deoxygenated water rather than as a direct result of lack of oxygen (McClain 2002)).	Muitas mortes naturais de peixes podem ocorrer se não houver refúgios oxigenados disponíveis (o motivo disso permanece especulativo: talvez seja por causa do crescimento de bactérias produtoras de toxina na água desoxigenada em vez de ser o resultado direto da falta de oxigênio (McClain 2002)).
The vegetation of the Pantanal, often referred to as the "Pantanal complex", is a mixture of plant communities typical of a variety of surrounding biome regions: these include moist tropical Amazonian rainforest plants, semiarid woodland plants typical of northeast Brazil, Brazilian cerrado savanna plants and plants of the Chaco savannas of Bolivia and Paraguay.	A vegetação do Pantanal, normalmente chamada de "complexo Pantanal", é uma combinação de comunidades de plantas típicas de uma variedade dos biomas da região ao redor: entre elas estão as plantas da úmida floresta Amazônica, plantas da mata semiárida típicas do nordeste brasileiro, plantas de savana do cerrado brasileiro e plantas de savana do Chaco da Bolívia e do Paraguai.
Forests usually occur at higher altitudes of the region, while grasslands cover the seasonally inundated areas.	As florestas costumam ocorrer em altitudes mais elevadas da região, enquanto as pradarias cobrem as áreas inundadas sazonalmente.
The key limiting factors for growth are inundation and, even more importantly, water-stress during the dry season.	Os principais fatores limitadores do crescimento são inundação e, principalmente, a falta de água durante a temporada seca.
According to Embrapa, approximately 2000 different plants have been identified in the Pantanal biome and classified according to their potential, with some presenting significant medicinal promise.	Segundo a Embrapa, aproximadamente 2000 plantas diferentes foram identificadas no bioma do Pantanal e classificadas de acordo com o potencial, sendo que algumas apresentam um potencial medicinal considerável.
A portion of the Pantanal in Brazil has been protected as the Pantanal Matogrossense National Park.	Uma parte do Pantanal no Brasil foi protegida como o Parque Nacional do Pantanal Matogrossense.
This 1,350 square kilometres (520 sq mi) park, established in September 1981, is located in the municipality of Poconé in the State of Mato Grosso, between the mouths of the Baía de São Marcos and the Gurupi Rivers.	Esse parque de 1.350 km² (520 mi²), fundado em setembro de 1981, está localizado no município de Poconé no Estado de Mato Grosso, entre as fozes dos rios Baía de São Marcos e Gurupi.
The park was designated a Ramsar Site of International Importance under the Ramsar Convention on May 24, 1993.	O parque foi designado como um Sítio Ramsar de Importância Internacional sob a Convenção de Ramsar em 24 de maio de 1993.
The SESC Pantanal Private Natural Heritage Reserve (Reserva Particular do Patrimonio Natural SESC Pantanal) is a privately owned reserve in Brazil, established in 1998 and 878.7 km² (339.3 sq mi) in size.	A Reserva Particular do Patrimônio Natural SESC Pantanal (SESC Pantanal Private Natural Heritage Reserve) é uma reserva particular no Brasil, fundada em 1998 e com 878,7 km² (339,3 mi²).
It is located in the north-eastern portion, known as "Poconé" Pantanal, not far from the Pantanal National Park.	Ela está localizada na parte nordeste, conhecida como "Poconé" Pantanal, perto do Parque Nacional do Pantanal.
It is a mix of permanent rivers, seasonal streams, permanent and seasonal floodplain freshwater lakes, shrub-dominated wetlands and seasonally flooded forests, all dedicated to nature preservation, and was designated a Ramsar Site of International Importance under the Ramsar Convention.	É uma combinação de rios permanentes, córregos sazonais, lagos de água doce permanentes e sazonais na planície aluvial, pântanos dominados por arbustos e florestas inundadas sazonalmente, tudo isso dedicado à preservação da natureza e indicada como Sítio Ramsar de Importância Internacional sob a Convenção de Ramsar.
Otuquis National Park and Integrated Management Natural Area is a national park of Bolivia in the Pantanal.	O Parque Nacional de Otuquis e Área Natural de Gestão Integrada é um parque nacional da Bolívia no Pantanal.
The entrance to Otuquis National park is through the town of Puerto Suarez.	A entrada para o Parque Nacional de Otuquis é pela cidade de Puerto Suarez.
Lídia Jorge was born in the village of Boliqueime in the Algarve region of southern Portugal in 1946.	Lídia Jorge nasceu na vila de Boliqueime na região de Algarve, sul de Portugal, em 1946.
After finishing secondary school she moved to Lisbon to attend the Universidade de Lisboa (University of Lisbon) where she obtained an Honours degree in Romanic Philology.	Depois de concluir o ensino médio, ela mudou-se para Lisboa para frequentar a Universidade de Lisboa (University of Lisbon), onde obteve licenciatura em filologia românica.
Soon after completing these studies she became a secondary school teacher.	Logo depois de concluir esses estudos, ela tornou-se professora da escola secundária.
She married a Portuguese military man, who served in the Portuguese colonies in Africa, and spent six very influential years in Portuguese-speaking Africa, two in Angola (1968–1970) and four in Mozambique (1970–1974), a time that coincided with the latter period of the Portuguese Colonial War in Africa.	Ela casou-se com um militar português que serviu nas colônias portuguesas na África, e passou seis anos muito influentes na África portuguesa, dois em Angola (1968–1970) e quatro em Moçambique (1970–1974), época que coincidiu com o período final da guerra colonial portuguesa na África.
The author was divorced in 1977.	A autora divorciou-se em 1977.
Later on she formed a relationship with journalist Carlos Albino.	Depois, ela começou uma relação com o jornalista Carlos Albino.
Lídia Jorge lives in Lisbon and has two children and one grandchild.	Lídia Jorge reside em Lisboa e tem dois filhos e um neto.
Lídia Jorge’s first publication, the novel O Dia dos Prodígios [The Day of the Prodigies] (1980), is considered to be a major contribution to the new wave of modern Portuguese literature which followed the end of the Estado Novo regime in 1974.	A primeira publicação de Lídia Jorge, o romance O Dia dos Prodígios (1980), é considerado uma grande contribuição à nova onda da literatura moderna portuguesa, que veio logo após o regime do Estado Novo em 1974.
The two novels which followed, O Cais das Merendas [The Wharf of the Parties’ Remains] (1982) and Notícia da Cidade Silvestre [The Wild Town Remembering] (1984) both won the Literary Prize of the Lisbon Municipality.	Os dois romances seguintes, O Cais das Merendas (1982) e Notícia da Cidade Silvestre (1984) ganharam o Prêmio Literário do município de Lisboa.
However, it was with A Costa dos Murmúrios [The Murmuring Coast] (1988), a book that draws upon her experiences in colonial Africa, that the author confirmed her status as one of the leading figures in modern Portuguese literature.	No entanto, foi com A Costa dos Murmúrios (1988), um livro que explora as experiências dela na África colonial, que a autora confirmou o status de uma das figuras mais importantes da literatura portuguesa moderna.
In 1998 O Vale da Paixão [The Painter of Birds] won a number of awards including: the D.	Em 1998, O Vale da Paixão ganhou alguns prêmios, incluindo: o D.
Dinis Prize from the Casa de Mateus Foundation; the Bordalo Literature Prize from the Casa da Imprensa; the Máxima Literature Prize; the P.E.N. Club Fiction Prize; and in the year 2000, the Jean Monnet Prize for European Literature and European writer of the year.	Dinis Prize da Casa de Mateus Foundation; Prêmio Bordalo de Literatura da Casa da Imprensa; Prêmio de Literatura Máxima; P.E.N. Club Fiction Prize; e, no ano 2000, o Prêmio Jean Monnet para literatura europeia e escritora europeia do ano.
Four years later the novel O Vento Assobiando nas Gruas [The Wind Whistling in the Cranes] (2002) won the Grande Prémio da Associação Portuguesa de Escritores (Portuguese Writers' Association Prize) and the Prémio Correntes d'Escritas (Prize for New Currents in Writing).	Quatro anos depois, o romance O Vento Assobiando nas Gruas (2002) venceu o Grande Prémio da Associação Portuguesa de Escritores (Portuguese Writers' Association Prize) e o Prémio Correntes d'Escritas (Prize for New Currents in Writing).
In 2007 Lídia Jorge published the novel Combateremos a Sombra [We Shall Fight the Shadow], which was launched at the Fernando Pessoa Foundation in Lisbon.	Em 2007, Lídia Jorge publicou o romance Combateremos a Sombra, lançado pela Fundação Fernando Pessoa em Lisboa.
The Encyclopædia Britannica online speaks of its " ...	A Encyclopædia Britannica online fala sobre a "...
intricate poetic prose ... at once lyrical and suspenseful, Combateremos a Sombra follows its protagonist, the psychoanalyst Osvaldo Campos, through a densely plotted maze of personal and political deception." This novel won the Michel Brisset Prize 2008 awarded by the French Psychiatrists Association.	prosa poética complexa... ao mesmo tempo lírica e tensa, Combateremos a Sombra segue o protagonista, o psicanalista Osvaldo Campos, por uma trama densa de simulação pessoal e política." Esse romance venceu o Prêmio Michel Brisset de 2008 concedido pela Associação de Psiquiatras Franceses.
In 2009 the author published the essay Contrato Sentimental [Sentimental Contract], a critical reflection on the future of Portugal.	Em 2009, o autor publicou o ensaio Contrato Sentimental, uma ponderação crítica sobre o futuro de Portugal.
Her latest novel (2011) is entitled A Noite das Mulheres Cantoras [The Night of the Singing Women].	O romance mais recente dela (2011) é chamado de A Noite das Mulheres Cantoras.
The author has had two anthologies of short stories published, Marido e Outros Contos [Husband and Other Stories] (1997) and O Belo Adormecido [The Sleeping Beau] (2003), and the stand-alone stories A Instrumentalina (1992) and O Conto do Nadador [The story of the Swimmer] (1992).	A autora teve duas antologias de histórias curtas publicadas, Marido e Outros Contos (1997) e O Belo Adormecido (2003), e as histórias independentes A Instrumentalina (1992) e O Conto do Nadador (1992).
Lídia Jorge has also written for the younger public: O Grande Voo do Pardal [The Great Flight of the Sparrow] (2007) illustrated by Inês de Oliveira, and Romance do Grande Gatão [Big Tomcat's Novel] (2010) illustrated by Danuta Wojciechowska.	Lídia Jorge também escreveu para o público mais jovem: O Grande Voo do Pardal (2007), ilustrado por Inês de Oliveira, e Romance do Grande Gatão (2010), ilustrado por Danuta Wojciechowska.
Lídia Jorge’s stage play A Maçon [The Mason] was performed at Teatro Nacional Dona Maria II in 1997.	A peça de teatro de Lídia Jorge A Maçon foi apresentada no Teatro Nacional Dona Maria II em 1997.
A Costa dos Murmurios has been recently adapted for the cinema by Margarida Cardoso.	A Costa dos Murmúrios foi adaptada recentemente para o cinema por Margarida Cardoso.
O Dia dos Prodígios was adapted for the stage and directed by Cucha Carvalhelho; the play was performed at Teatro Trindade, Lisboa, and Cineteatro Louletano in 2011.	O Dia dos Prodígios foi adaptado para o teatro sob a direção de Cucha Carvalhelho; a peça foi apresentada no Teatro Trindade, em Lisboa, e no Cineteatro Louletano em 2011.
On the 30th anniversary of the publication of O Dia dos Prodígios the Council of Loulé organised a commemorative exhibition of her work entitled 30 Anos de Escrita Publicada [30 Years of Published Writing].	No 30º aniversário da publicação de O Dia dos Prodígios, a Assembleia de Loulé organizou uma exposição comemorativa da obra dela intitulada 30 Anos de Escrita Publicada [30 Years of Published Writing].
The exhibition was open to the public between November 2010 and March 2011, during which a series of talks, discussions and guided tours took place.	A exposição ficou aberta ao pública entre novembro de 2010 e março de 2011, período em que ocorreu uma série de palestras, discussões e tours guiados.
In 2005 Lídia Jorge became France Commandeur de l'Ordre des Arts et des Lettres.	Em 2005, Lídia Jorge tornou-se France Commandeur de l'Ordre des Arts et des Lettres.
In 2006 she attended a ceremony in Germany where she was awarded the first ever International Albatroz Literature Prize by the Günter Grass Foundation for her work to date.	Em 2006, ela participou de uma cerimônia na Alemanha onde recebeu o primeiríssimo Prêmio Internacional de Literatura Albatroz da Günter Grass Foundation por sua obra até o momento.
She won the Latin Union International Prize in 2011.	Em 2011, ela venceu o Prêmio Internacional da União Latina.
Lídia Jorge is Doctor Honoris Causa by the Universidade do Algarve (2010).	Lídia Jorge ganhou o título de Doutora Honoris Causa pela Universidade do Algarve (2010).
In 2008 the author took part in the First International Writers Festival in Jerusalem, Israel.	Em 2008, a autora participou do Primeiro Festival Internacional de Escritores em Jerusalém, Israel.
Lídia Jorge’s books are published in Portugal by Publicações Dom Quixote, except Contrato Sentimental, published by Editora Sextante.	Os livros de Lídia Jorge são publicados em Portugal pela Publicações Dom Quixote, exceto Contrato Sentimental, publicado pela Editora Sextante.
Her German agent is Literarische Agentur Dr. Ray-Güde Mertin based in Frankfurt.	O agente alemão dela é Literarische Agentur Dr. Ray-Güde Mertin, com sede em Frankfurt.
She also has a French agent.	Além disso, ela tem um agente francês.
The author’s novels have been published in Brazil and translated into Spanish, French, English, German, Italian, Greek, Hebrew and Swedish.	Os romances da autora foram publicados no Brasil e traduzidos para espanhol, francês, inglês, alemão, italiano, grego, hebraico e sueco.
At present Lídia Jorge writes a newspaper column twice a week for Jornal Público, a Portuguese newspaper.	No momento, Lídia Jorge escreve uma coluna duas vezes por semana para o Jornal Público, um jornal português.
The university was founded, or ratified, in 1290 by King Dinis, having begun its existence in Lisbon with the name Studium Generale (Estudo Geral).	A universidade foi fundada, ou homologada, em 1290 pelo Rei Dinis, e sua existência começou em Lisboa com o nome de Estudo Geral (Studium Generale).
Scientiae thesaurus mirabilis, the royal charter announcing the institution of the University was dated 1 March of that year, although efforts had been made at least since 1288 to create this first University in Portugal; it is thus the second oldest of such establishments in the Iberian Peninsula.	Scientiae thesaurus mirabilis, o alvará real que anuncia o estabelecimento da Universidade tinha data de 1 de março daquele ano, apesar de terem sido feito esforços pelo menos desde 1288 para a criação dessa primeira Universidade em Portugal; é, portanto, o segundo estabelecimento mais velho desse tipo na Península Ibérica.
The Papal confirmation was also given in 1290 (on 9 August of that year), during the Papacy of the Pope Nicholas IV.	A confirmação Papal também foi dada em 1290 (em 9 de agosto desse ano) durante o papado do Papa Nicolau IV.
In accordance with the Papal Bull, all the "licit" Faculties, with the exception of that of Theology, could be established.	De acordo com a Bula Papal, era possível estabelecer todas as Faculdades "lícitas", com exceção da faculdade de Teologia.
Thus the Faculties of Arts, Law, Canon Law and Medicine were the first to be created.	Assim, as Faculdades de Artes, Direito, Direito Canônico e Medicina foram as primeiras a serem criadas.
It was, however, not to remain in Lisbon for long.	No entanto, ela não ficaria em Lisboa por muito tempo.
