However, the club's strong team spirit, the goals of Emanuele Del Vecchio, its relatively stable campaign and the 2-1 victory over Taubaté, Santos' last match in the competition, ensured the club would win their second state title ever, the first in 20 years.	No entanto, o forte espírito de equipe do club, os gols de Emanuele Del Vecchio, sua campanha relativamente estável e a vitória de 2 a 1 sobre o Taubaté, a última partida do Santos na competição, garantiram ao clube o segundo título estadual, o primeiro em 20 anos.
Del Vecchio's 38 goals were the club's highest season tally since Patusca's 53 in 1927.	Os 38 gols do Del Vecchio representaram a maior contagem do clube na temporada desde os 53 de Patusca em 1927.
He was also the Paulistãos' top scorer with 23 goals.	Além disso, ele foi artilheiro do Paulistão com 23 gols.
An infamous club anthem, "Leão do Mar", was created in order to commemorate this triumph.	Um hino famoso do clube, "Leão do Mar", foi criado para comemorar esse triunfo.
In order to build upon the moment and provide a capable defense of the state title, Cury set in motion a series of plans and contracts after predicting that several of its veterans might opt to leave the club in a repeat of the aftermath in 1935.	Para aproveitar o momento e conseguir defender o título estadual, Cury executou uma série de planos e contratos após prever que vários de seus veteranos pudessem optar por sair do clube, em uma repetição do que ocorrem em 1935.
He secured the services of several established players such as Zito.	Ele garantiu os serviços de vários jogadores consagrados, como o Zito.
Cury also invested to keep several young potentials like Pepe and the upcoming Pagão.	Cury também investiu para manter várias promessas jovens, como Pepe e Pagão, que seria apresentado.
The club president also gave Lula leeway to scout talented individuals who were trying out for the club.	O presidente do clube também deu a Lula liberdade para escolher talentos individuais que estavam fazendo teste para o clube.
Perhaps the greatest signing Cury approved of was that of a 15-year-old boy brought over to Vila Belmiro by Waldemar de Brito.	Talvez, a maior contratação aprovada por Cury tenha sido a de um garoto de 15 anos, levado até a Vila Belmiro por Waldemar de Brito.
De Brito, who was a manager of Bauru Atlético Clube's junior squad, won three consecutive São Paulo state youth championships between 1954 and 1956 with the child.	De Brito, que era treinador da equipe júnior do Bauru Atlético Clube, venceu três campeonatos juvenis consecutivos do estados São Paulo entre 1954 e 1956 junto com o jovem.
The boy, called Edson Arantes do Nascimento and who would be better known as Pelé in the near future, was the main driving force behind those victories.	O garoto, chamado Edson Arantes do Nascimento e que ficaria mais conhecido como Pelé no futuro próximo, era a principal força por trás dessas vitórias.
The contract between Santos and the young Pelé was finalized in June 1956.	O contrato entre o Santos e o jovem Pelé foi assinado em junho de 1956.
After 50 years Santos began to be seen as the best team in the world.	Após 50 anos, Santos começava a ser visto como a melhor equipe do mundo.
When Pelé made his debut in the Campeonato Paulista in 1957, the team was already twice state champion (1955/56). The King had as fellow players Zito, Pagão, Formiga, Hélvio, Jair da Rosa Pinto, Urubatão, Tite and Pepe.	Quando Pelé estreou no Campeonato Paulista em 1957, a equipe já havia sido duas vezes campeã estadual (1955/56). O Rei tinha como companheiros Zito, Pagão, Formiga, Hélvio, Jair da Rosa Pinto, Urubatão, Tite e Pepe.
Santos won the third state title in 50 years, the magical year of 1958 – in which Brazil won the World Cup in Sweden, with Zito Santos, Pelé and Pepe, and won in spectacular fashion.	Santos conquistou o terceiro título estadual em 50 anos, no ano mágico de 1958 – ano no qual o Brasil conquistou a Copa do Mundo da Suécia — com Zito Santos, Pelé e Pepe, e de uma maneira espetacular.
Santos scored 143 goals in 38 games, averaging 3.76 per game, and conceded only 40 goals.	O Santos marcou 143 gols em 38 jogos, uma média de 3,76 por jogo, e tomou apenas 40 gols.
Pelé set a record that has never been equaled in any state competition in the country: he scored no less than 58 goals.	Pelé estabeleceu um recorde que nunca foi igualado em qualquer competição estadual: ele marcou nada menos do que 58 gols.
Santos' traditional rivals were heavily beaten in 1958, particularly a 10–0 win against the Nacional.	Os rivais tradicionais do Santos apanharam muito em 1958, em particular uma vitória de 10 a 0 contra o Nacional.
In addition to state titles, Santos won the Rio-São Paulo in 1959, beating Vasco in the final by 3–0 with two goals by Coutinho, who was only 16 years old.	Além dos títulos estaduais, Santos conquistou o Rio-São Paulo em 1959, derrotando o Vasco na final por 3 a 0 com dois gols de Coutinho, que tinha apenas 16 anos.
Coutinho also scored five goals against Ponte Preta, and Santos won the game by 12–1 even without Pelé.	Coutinho também marcou cinco gols contra a Ponte Preta, e o Santos venceu o jogo por 12 a 1, mesmo sem o Pelé.
No other team had a dominance in Brazilian football as great as Santos in the 1960s.	Nenhuma outra equipe dominava o futebol brasileiro nos anos 1960 como o Santos.
The club won eight titles: six Brazilian Championships (five Taça Brasil and one Torneio Roberto Gomes Pedrosa), two Copas Libertadores, two Intercontinental Cups, three Rio-São Paulo, a South American Recopa, a World and numerous international tournaments.	O clube conquistou oito títulos: seis campeonatos brasileiros (cinco Taças Brasil e um Torneio Roberto Gomes Pedrosa), duas Copas Libertadores, duas Copas Intercontinentais, três Rio-São Paulo, uma Recopa Sul-Americana, um Mundial e vários torneios internacionais.
A poll in the magazine El Gráfico saw dozens of experts from South America and Europe choose the Santos side of 1962/63 as the best team of all time.	Em uma enquete na revista El Gráfico, dezenas de especialistas da América do Sul e da Europa escolheram o time do Santos de 1962/63 como a melhor de todos os tempos.
In demand worldwide, Santos became the first globetrotting football team and played exhibition matches in dozens of countries.	Procurado no mundo todo, o Santos tornou-se a primeira equipe de futebol viajante, jogando partidas de exibição em dezenas de países.
A war in Africa was stopped so that the two sides could see Pelé's team play.	Uma guerra na África foi interrompida para que os dois lados pudessem ver a equipe de Pelé jogar.
Under pressure from the CBD (Brazilian Sport Confederation), which the team did not want to risk their star players in unsafe stadiums in South America, Santos did not participate in the editions of the Libertadores 1966, 1967 and 1969.	Sob pressão da CBD (Confederação Brasileira de Desportos), pois a equipe não queria arriscar seus jogadores astros em estádios precários na América do Sul, o Santos não participou das edições da Libertadores de 1966, 1967 e 1969.
Players from Santos and Botafogo formed the basis of the Brazilian World Cup sides in Chile (1962) and Mexico (1970).	Os jogadores do Santos e do Botafogo formaram a base das equipes do Brasil nas Copas do Mundo do Chile (1962) e do México (1970).
On two occasions – against Germany and England – the national team had eight Santos players in the team.	Em duas ocasiões, contra a Alemanha e a Inglaterra, a equipe nacional contava com oito jogadores do Santos.
In six games of qualifying for the 1970 World Cup "The beasts of the Saldanha" played with six Santos players : Carlos Alberto, Djalma Dias, Joel Camargo, Rildo, Pelé and Edu.	Em seis jogos das eliminatórias da Copa do Mundo de 1970, "as feras de Saldanha" contavam com seus jogadores do Santos: Carlos Alberto, Djalma Dias, Joel Camargo, Rildo, Pelé e Edu.
The influence of Santos was so great that the defense played with the national team the same numbers that were used at Santos: right-back with the shirt 4, right center-back with the second, left center-back with the sixth and left-back with three.	A influência do Santos era tanta que a defesa do time jogou na equipe nacional usando os mesmos números usados no Santos: o lateral direito com a camisa 4, zagueiro pela direita com a camisa dois, o zagueiro pela esquerda com a camisa seis e o lateral esquerdo com a camisa três.
Finally, left-winger Antônio Simões, Benfica and Portugal said: "I compare the Santos 62 team with the national team of Brazil in 70.	Por fim, o ala esquerdo Antônio Simões, do Benfica e de Portugal disse: "Eu comparo a equipe do Santos de 62 com a equipe nacional do Brasil de 70.
These are the two best football teams I have ever seen.	Essas são as duas melhores equipes de futebol que eu já vi.
The 70 side is the confirmation of a game model that Santos already demonstrated long ago."	A equipe de 70 é a confirmação de um modelo de jogo que o Santos já demonstrava há muito tempo."
Santos was champion in 1973, still with Pelé in the team, and again in 1978, driven by the amazing Pita Boys Town, Juary, João Paulo and Nilton Batata, the Santos of the 1970s were no longer just appreciated for the refinement of their football and became a symbol of passion and rapture.	O Santos foi campeão em 1973, ainda com Pelé na equipe, e de novo em 1978, liderado pelo incrível Pita e os Meninos da Vila, Juary, João Paulo e Nilton Batata. O Santos dos anos 1970 deixou de ser apenas apreciado pelo requinte de seu futebol e se tornou um símbolo de paixão e êxtase.
Their fans, who for a long time could not compete with the teams of the capital, steadily grew in number and started to compete with the massive Morumbi crowd, and significantly passed São Paulo and Palmeiras.	Os torcedores do time, que por muito tempo não eram capazes de competir com as equipes da capital, cresceram constantemente em número e passaram a disputar com a imensa torcida do Morumbi, e superaram consideravelmente o São Paulo e o Palmeiras.
When it seemed that the fate of the club would be hopelessly compromised by debt made millions for the purchase of the luxurious Spa Park, Santos came back to be only eleven shirts who fought and drew crowds.	Quando pareceu que o destino do clube seria desesperadamente comprometido por uma dívida de milhões contraída para a compra do luxuoso Parque Spa, Santos voltou a ser apenas onze camisas que lutavam e atraíam multidões.
In one of the worst moments of its history, which resulted in the loss of the Spa Park and all that was invested in him, Santos rose a charismatic worship, which had its greatest asset in his legions of fans.	Em um dos piores momentos da história, que resultou na perda do Parque Spa e em todo o dinheiro investido, Santos obteve uma adoração carismática, cujo grande ativo era sua legião de fãs.
The period began with the Santos became the vice-champion of the São Paulo state championship of 1980, and the executioner of this final Santos – São Paulo fan striker Serginho – is who would become the idol of the decade Santos.	O período começou com o Santos tornando-se vice-campeão do campeonato estadual de São Paulo de 1980, e o carrasco dessa final do Santos – o atacante torcedor do São Paulo, Serginho – se tornaria o ídolo da década no Santos.
Maria Cavaco Silva was born Maria Alves da Silva, to Francisco dos Santos Silva and Adelina de Jesus Pincho, on 19 March 1938, in São Bartolomeu de Messines, Silves (Algarve).	Maria Cavaco Silva nasceu Maria Alves da Silva, filha de Francisco dos Santos Silva e Adelina de Jesus Pincho, em 19 de março de 1938, em São Bartolomeu de Messines, Silves (Algarve).
Her mother died in her youth, and she ended up being raised by her uncle and aunt in Lisbon.	A mãe dela morreu ainda jovem, e ela acabou sendo criada pelo tio e pela tia em Lisboa.
She Licentiated in Germanic Philology from the University of Lisbon in 1960.	Ela se formou em filologia germânica pela Universidade de Lisboa em 1960.
Her final thesis was about "Yearning (saudade) in Hölderlin's Poetry".	A tese final dela foi sobre "Saudade (yearning) na Poesia de Hölderlin".
She also has a degree in Pedagogical Sciences from that same University, and began working as a teacher in 1960, in the Colégio das Doroteias.	Ela também tem um diploma em ciências pedagógicas dessa mesma universidade, e começou a trabalhar como professora em 1960, no Colégio das Doroteias.
She has also taught in the Liceu Passos Manuel, Liceu Rainha D.	Ela também lecionou no Liceu Passos Manuel, Liceu Rainha D.
Leonor and Liceu D. João de Castro, all of them in Lisbon.	Leonor e Liceu D. João de Castro, todos em Lisboa.
It was while holidaying in the Algarve that she met Aníbal Cavaco Silva, whom she married on 20 October 1963.	Enquanto ela passava feriado em Algarve, conheceu Aníbal Cavaco Silva, com quem se casou em 20 de outubro de 1963.
Later that same year, her husband was summoned for military duty in the Colonial War, in the then-Portuguese Overseas Province of Mozambique, and Maria Cavaco Silva accompanied him.	Mais tarde nesse mesmo ano, o marido dela foi convocado para o serviço militar na Guerra Colonial, na então província portuguesa de Moçambique no exterior, e Maria Cavaco Silva o acompanhou.
She lived in Lourenço Marques (modern-day Maputo), where she taught Portuguese language and foreign languages at Liceu Salazar and Liceu D.	Ela viveu em Lourenço Marques (atual Maputo), onde ensinou português e idiomas estrangeiros no Liceu Salazar e no Liceu D.
Ana da Costa Portugal.	Ana da Costa Portugal.
In 1971, they both moved to York, in England, while her husband studied Economics in the University of York.	Em 1971, os dois se mudaram para York, na Inglaterra, enquanto o esposo estudava economia na Universidade de York.
Once there, Maria Cavaco Silva attended German and Italian courses at the Language Teaching Centre, and taught Portuguese privately to foreigners.	Lá, Maria Cavaco Silva frequentou cursos de alemão e italiano no Language Teaching Centre e deu aulas particulares de português para estrangeiros.
Simultaneously, she enjoyed the opportunity to deepen her knowledge of English culture and language.	Simultaneamente, ela aproveitou a oportunidade para aprofundar o próprio conhecimento sobre a cultura inglesa e o idioma.
The Cavaco Silvas returned to Portugal in 1974.	Os Cavaco Silvas voltaram para Portugal em 1974.
In 1977, Maria became a lecturer of Portuguese language of the Philosophy course at the Catholic University, in Lisbon.	Em 1977, Maria tornou-se palestrante de idioma português do curso de Filosofia na Universidade Católica, em Lisboa.
Starting in 1981, she taught the same subject in the Theology course, and the Portuguese Language and Culture subject of the Law course of the Faculty of Human Sciences of that University.	A partir de 1981, ela lecionou a mesma matéria no curso de Teologia e a matéria Idioma e cultura portuguesa do curso de Direito da faculdade de ciências humanas daquela universidade.
Still in this Faculty, she headed, in July/August 1985, the Luso-American summer course about "The Portuguese Language in Contemporary Portuguese Novels".	Ainda nessa faculdade, ela comandou, em julho/agosto 1985, o curso de verão luso-americano sobre "O idioma português em romances portugueses contemporâneos".
She then began teaching the Annual Portuguese Course for Foreigners, in the Socrates/Erasmus programme, which she led until 2006.	Então, ela começou a lecionar no Curso anual de português para estrangeiros, no programa Sócrates/Erasmus, que ela conduziu até 2006.
Today, she is still connected to that University, and occasionally gives lectures on Literature and Portuguese Culture.	Hoje, ela ainda está conectada a essa Universidade e, às vezes, dá palestras sobre literatura e cultura portuguesa.
She was teaching there during her husband's term as Prime Minister of Portugal (from 1985 to 1995)	Ela lecionou lá durante o mandato de seu marido como primeiro-ministro de Portugal (de 1985 a 1995)
On 22 January 2006, her husband was elected President of Portugal, with 50,6% of the votes.	Em 22 de janeiro de 2006, o marido dela foi eleito presidente de Portugal, com 50,6% dos votos.
She became the First Lady of Portugal, succeeding Maria José Ritta, Jorge Sampaio's wife, in March of that year.	Ela se tornou a primeira-dama de Portugal, sucedendo Maria José Ritta, esposa de Jorge Sampaio, em março daquele ano.
Her activity agenda included the challenges that families and the youth face in today's world, or the new demands in social assistance.	A agenda de atividades dela incluía os desafios enfrentados por famílias e pelos jovens no mundo atual, ou as novas demandas de assistência social.
As it had already happened in the 1980s and the 1990s, when her husband was Prime Minister, attending official acts and institutional events, as well as contacting with organisations, associations and several entities of the civil society, is a large part of her daily routine.	Como já havia acontecido nos anos 1980 e 1990, quando o marido dela foi primeiro-ministro, a rotina diária dela era preenchida em grande parte por atos oficiais e eventos institucionais, além do contato com organizações, associações e entidades diversas da sociedade civil.
The couple currently has two children and five grandchildren.	O casal tem dois filhos e cinco netos.
Dilma Vana Rousseff was born in Belo Horizonte, Minas Gerais, southeastern Brazil, on 14 December 1947, to Bulgarian lawyer and entrepreneur Pedro Rousseff (born Petar Rúsеv, Bulgarian: Петър Русев, 1900–1962) and schoolteacher Dilma Jane da Silva (26 June 1924 – 13 July 2019).	Dilma Vana Rousseff nasceu em Belo Horizonte, Minas Gerais, sudeste do Brasil, no dia 14 de dezembro de 1947, filha do advogado e empreendedor búlgaro Pedro Rousseff (nascido Petar Rúsеv, búlgaro: Петър Русев, 1900 a 1962) e da professora Dilma Jane da Silva (26 de junho de 1924 a 13 de julho de 2019).
Her father was born in Gabrovo, in the Principality of Bulgaria, and was a friend of the Nobel Prize-nominated Bulgarian poet Elisaveta Bagryana.	O pai dela nasceu em Gabrovo, no principado da Bulgária, e foi amigo da poeta búlgara indicada ao Prêmio Nobel, Elisaveta Bagryana.
As an active member of the Bulgarian Communist Party, banned in 1924, Petar Rusev fled Bulgaria in 1929 to escape political persecution; he settled in France.	Como membro ativo do Partido Comunista Búlgaro, banido em 1924, Petar Rusev fugiu para a Bulgária em 1929 para escapar da perseguição política; ele se estabeleceu na França.
He arrived in Brazil in the 1930s, already widowed (he left behind his son Lyuben, who died in 2007), but soon moved to Buenos Aires, Argentina.	Ele chegou no Brasil nos anos 1930, já viúvo (deixou para trás o filho Lyuben, que morreu em 2007), mas logo se mudou para Buenos Aires, Argentina.
He returned to Brazil several years later, settling in São Paulo, where he succeeded in business.	Anos depois, ele voltou ao Brasil, se estabelecendo em São Paulo, onde teve sucesso nos negócios.
Pétar Rúsev adapted his first name to Portuguese (Pedro) and the last to French (Rousseff).	Pétar Rúsev adaptou o nome para português (Pedro) e o sobrenome para francês (Rousseff).
During a trip to Uberaba, he met Dilma Jane da Silva, a young schoolteacher born in Nova Friburgo, Rio de Janeiro, and raised in Minas Gerais, where her parents were ranchers.	Durante uma viagem para Uberaba, ele conheceu Dilma Jane da Silva, uma jovem professora nascida em Nova Friburgo, Rio de Janeiro, e criada em Minas Gerais, onde os pais dela eram fazendeiros.
The two married and settled in Belo Horizonte, where they had three children: Igor, Dilma Vana, and Zana Lúcia (who died in 1977).	Os dois se casaram e firmaram residência em Belo Horizonte, onde tiveram três filhos: Igor, Dilma Vana e Zana Lúcia (que morreu em 1977).
Igor Rousseff, Dilma's elder brother, is a lawyer.	Igor Rousseff, o irmão mais velho de Dilma, é advogado.
Pedro Rousseff was a contractor for Mannesmann steel in addition to building and selling real estate.	Pedro Rousseff era contratado de Mannesmann aço, além de construir e vender imóveis.
The family lived in a large house, had three servants, and maintained European habits.	A família vivia em uma grande casa, tinha três empregadas e mantinha hábitos europeus.
The children had a classical education with both piano and French lessons.	As crianças tinham educação clássica e aulas de piano e de francês.
After they overcame the initial resistance of the community to accepting foreigners, the family attended traditional clubs and schools.	Depois de superarem a resistência inicial da comunidade em aceitar estrangeiros, a família frequentou clubes e escolas tradicionais.
Rousseff was enrolled in preschool at the Colégio Izabela Hendrix and primary school at Colégio Nossa Senhora de Sion, a girls' boarding school run by nuns, who primarily taught in French.	Rousseff foi matriculada na pré-escola do Colégio Izabela Hendrix e no primário no Colégio Nossa Senhora de Sion, uma escola de meninas administrada por freiras e que ensinavam principalmente em francês.
Her father died in 1962, leaving behind about fifteen properties.	O pai dela morreu em 1962, deixando cerca de quinze propriedades.
In 1964 Rousseff left the conservative Colégio Sion and joined the Central State High School, a co-ed public school where the students often protested against the dictatorship that had been established after the 1964 Brazilian coup d'état.	Em 1964, Rousseff saiu do conservador Colégio Sion e entrou para o Colégio Estadual Central, uma escola pública mista na qual os estudantes costumavam protestar contra a ditadura que comandava o país após o golpe de estado de 1964.
In 1967 she joined Worker's Politics (Portuguese: Política Operária—POLOP), an organization founded in 1961 as a spinoff of the Brazilian Socialist Party.	Em 1967, ela entrou para a Política Operária—POLOP (Worker's Politics), uma organização fundada em 1961 como braço do Partido Socialista Brasileiro.
Its members found themselves divided over methods; some wanted to advocate for the election of a constituent assembly, but others advocated an armed struggle.	Os membros da organização tinham diferenças com relação aos métodos; alguns defendiam a eleição de uma assembleia constituinte, mas outros defendiam um confronto armado.
Rousseff joined the second group, which became the National Liberation Command (Portuguese: Comando de Libertação Nacional—COLINA).	Rousseff juntou-se ao segundo grupo, que se tornou o Comando de Libertação Nacional—COLINA (National Liberation Command).
According to Apolo Heringer Lisboa, leader of Colina in 1968 who taught Marxism to Rousseff in high school, she chose armed struggle after reading Revolution inside the Revolution by Régis Debray, a French intellectual who had moved to Cuba and become a friend of Fidel Castro and Che Guevara.	Segundo Apolo Heringer Lisboa, líder do Colina em 1968 e quem ensinava Marxismo para Rousseff no colégio, ela escolheu o confronto armado depois de ler Revolução dentro da revolução, de Régis Debray, um intelectual francês que havia se mudado para Cuba e ficado amigo de Fidel Castro e Che Guevara.
Heringer says that "the book inflamed everybody, including Dilma".	Heringer disse que "o livro instigara todo mundo, incluindo a Dilma".
During that period, Rousseff met Cláudio Galeno Linhares, a brother-in-arms five years her senior.	Durantes esse período, Rousseff conheceu Cláudio Galeno Linhares, um irmão de armas cinco anos mais velho.
Galeno, who had joined POLOP in 1962, had served in the Army, participating in the uprising of sailors against the military coup, for which he had been arrested in Ilha das Cobras.	Galeno, que havia se juntado ao POLOP em 1962, tinha servido no exército, participando da revolta de marinheiros contra o golpe militar, motivo pelo qual havia sido preso na Ilha das Cobras.
They married in 1968 in a civil ceremony, after dating for one year.	Eles se casaram em 1968 em uma cerimônia civil, depois de namorarem por um ano.
Rousseff participated in COLINA and advocated Marxist politics among labour union members and as editor of the newspaper The Piquet.	Rousseff participou do COLINA e defendeu políticas Marxistas entre membros do sindicato trabalhista e como editora do jornal O Piquete.
According to the magazine Piauí, she handled weapons.	Segundo a revista Piauí, ela usava armas.
Gilberto Vasconcelos, a former fellow militant, has stated that she "has never … practiced an act of violence".	Gilberto Vasconcelos, um antigo militante, afirmou que ela "nunca havia… praticado um ato de violência".
In early 1969 the Minas Gerais branch of Colina had only a dozen militants, little money, and few weapons.	No início de 1969, o braço de Minas Gerais do Colina tinha apenas uma dezena de militantes, pouco dinheiro e algumas armas.
Its activities boiled down to four bank robberies, some stolen cars and two bombings, with no casualties.	As atividades do grupo se resumiram a quatro roubos a banco, alguns carros roubados e duas explosões de bomba, sem mortes.
On 14 January, after some arrests during a bank robbery, they gathered to debate what to do to release them from jail.	Em 14 de janeiro, após algumas prisões durante um assalto a banco, eles se reuniram para debater o que fazer para libertá-los da cadeia.
