Constâncio was Secretary of State for Planning in the I and II Provisional Government of Portugal from 1974 to 1975, and Secretary of State for Budget and Planning in 1976 in the IV Provisional Government.	Constâncio foi Secretário de Estado para Planejamento no 1º e 2º Governos Provisórios de Portugal, de 1974 a 1975, e Secretário de Estado para Orçamento e Planejamento em 1976 no 4º Governo Provisório.
He then became Finance Minister from January to August 1978 in the II Constitutional Government of Portugal, and is therefore until now the youngest Portuguese Finance Minister since the revolution.	Depois, tornou-se Ministro das Finanças de janeiro a agosto de 1978 no 2º Governo Constitucional de Portugal, e é, portanto, até hoje, o Ministro das Finanças português mais jovem desde a revolução.
Constâncio was secretary-general of the Socialist Party from 1986 to 1989.	De 1986 a 1989, Constâncio foi secretário-geral do Partido Socialista.
He lost the legislative elections of 19 July 1987, but remained in office.	Ele perdeu as eleições legislativas de 19 de julho de 1987, mas permaneceu no gabinete.
He resigned the following year, being replaced by Jorge Sampaio.	No ano seguinte, ele renunciou, sendo substituído por Jorge Sampaio.
Constâncio was governor of the Banco de Portugal, the Portuguese central bank, for the first time in 1985-86, having been appointed vice-governor in 1977, in 1979, and in the period from 1981 to 1984.	Constâncio foi governador do Banco de Portugal, o banco central português, pela primeira vez em 1985-86 e foi indicado vice-governador em 1977, em 1979 e no período de 1981 a 1984.
From 1993 to 1994, Constâncio served as chairman of Lisboa 94, the entity in charge of organizing the commemorative events of Lisbon as European Capital of Culture.	De 1993 a 1994, Constâncio serviu como presidente da Lisboa 94, e entidade encarregada da organização de eventos comemorativos de Lisboa, como capital europeia da cultura.
Between 1995 and 1999, Constâncio was a member of the Portuguese Council of State.	Entre 1995 e 1999, Constâncio foi membro do Conselho de Estado português.
During the same period, he served as Member of the Board (Executive Director) of Banco Português de Investimento (BPI), a leading private Portuguese banking group, with responsibility for Budget, Accounting and Control of Financial Market Risks.	Durante o mesmo período, ele serviu como Membro da Diretoria (diretor executivo) do Banco Português de Investimento (BPI), um grupo bancário privado português líder, sendo responsável por Orçamento, Contabilidade e Controle dos Riscos do Mercado Financeiro.
In this capacity, he represented BPI as non-executive member of the board of Portugal Telecom and subsequently as non-executive member of the Board of Energias de Portugal.	Nessa função, ele representou o BPI como um membro não executivo da diretoria da Portugal Telecom e, subsequentemente, como membro não executivo da diretoria de Energias de Portugal.
Constâncio served once more as governor of the Banco de Portugal from 2000 to 2010, having been re-appointed in 2006.	Constâncio trabalhou mais uma vez como governador do Banco de Portugal de 2000 a 2010, após ser indicado novamente em 2006.
Under his presidency the Bank of Portugal spent one third of its original holdings of 600 tons of gold to 400 tons, approximately.	Sob a presidência dele, o Banco de Portugal gastou um terço de seu títulos originais de 600 toneladas de ouro, ou 400 toneladas, aproximadamente.
While in office, he advocated salaries stagnation or increases below inflation, as a way to increase the Portuguese economy's competitiveness.	No gabinete, ele defendeu a estagnação salarial ou aumentos abaixo da inflação, como uma maneira de aumentar a competitividade da economia de Portugal.
In 2005, Constâncio enraged right-wing politicians when he reviewed the previous conservative government's figures and revised the deficit up from around 3% to 6.8%.	In 2005, Constâncio enfureceu políticos de direita quando revisou os números do antigo governo conservador e elevou o déficit de 3% a 6,8%.
Two Portuguese banks (Banco Português de Negócios (BPN) and Banco Privado Português (BPP) had been accumulating losses for years due to bad investments, embezzlement and accounting fraud.	Dois bancos portugueses, Banco Português de Negócios (BPN) e Banco Privado Português (BPP), acumularam perdas durante anos devido a investimentos ruins, peculato e fraude contábil.
The Portuguese Central Bank, led by Constâncio, was criticized for having allowed this situation for years.	O Banco Central Português, liderado por Constâncio, foi criticado por permitir que essa situação perdurasse durante anos.
Constâncio was first mentioned as a potential vice president of the European Central Bank in 2002, to replace Christian Noyer.	Primeiro, Constâncio foi mencionado como possível vice-presidente do Banco Central Europeu em 2002 para substituir Christian Noyer.
He cited family reasons for refusing to run for the post.	Ele alegou motivos familiares ao recusar-se a concorrer para o cargo.
Constâncio was appointed vice president of European Central Bank, for an eight-year mandate.	Constâncio foi indicado a vice-presidente do Banco Central Europeu para um mandato de oito anos.
At the time, he was chosen by Eurozone finance ministers ahead of Peter Praet, director of the National Bank of Belgium, and Yves Mersch, the governor of the Bank of Luxembourg, to replace Lucas Papademos of Greece.	Na época, ele foi escolhido pelos ministros da zona do euro em detrimento de Peter Praet, diretor do Banco Nacional da Bélgica e Yves Mersch, governador do Banco de Luxemburgo, como substituto de Lucas Papademos da Grécia.
Shortly after, on 6 April 2011, the Portuguese Government, facing increasing difficulties in securing its financing needs in the international financial markets, formally requested international financial assistance leading to a €78 billion program with equal participation of the European Financial Stabilisation Mechanism, European Financial Stability Facility and International Monetary Fund.	Logo depois, em 6 de abril de 2011, o governo português, enfrentando cada vez mais dificuldades para garantir as próprias necessidades financeiras nos mercados financeiros internacionais, solicitou formalmente a assistência financeira internacional que resultou em um programa de € 78 bilhões com participação igualitária do Mecanismo Europeu de Estabilização Financeira, do Fundo Europeu de Estabilização Financeira e do Fundo Monetário Internacional.
José Sócrates was born in Porto on 6 September 1957, and was registered as a newborn in Vilar de Maçada, Alijó municipality, in northeastern Portugal, since the locality was his family ancestral homeland.	José Sócrates nasceu em Porto no dia 6 de setembro de 1957, e foi registrado como recém-nascido em Vilar de Maçada, município de Alijó, no nordeste de Portugal, já que o local era terra natal de sua família.
However, the young José Sócrates lived throughout his childhood and teen years with his father, a divorced building designer, in the city of Covilhã, Cova da Beira subregion, in central inland Portugal, in the Centro region.	Porém, o jovem José Sócrates viveu toda a infância e a adolescência com o pai, um projetista de edifícios divorciado, na cidade de Covilhã, sub-região da Cova da Beira, na região central do interior de Portugal.
His parents are Fernando Pinto de Sousa (Vilar de Maçada, Alijó, 15 November 1926 – Oporto, 18 July 2011) and wife and remote relative Maria Adelaide de Carvalho Monteiro (b.	Os pais dele são Fernando Pinto de Sousa (Vilar de Maçada, Alijó, 15 de novembro de 1926 – Oporto, 18 de julho de 2011) e a esposa e parente distante Maria Adelaide de Carvalho Monteiro (b.
Vilar de Maçada, Alijó, 8 October 1931).	Vilar de Maçada, Alijó, oito de outubro de 1931).
He has two younger siblings, António Carvalho Pinto de Sousa, born circa 1962, and Ana Maria Carvalho Pinto de Sousa, died in 1988.	Ele tem dois irmãos mais novos, António Carvalho Pinto de Sousa, nascido perto de 1962, e Ana Maria Carvalho Pinto de Sousa, que faleceu em 1988.
He is a descendant of the illegitimate daughter of António José Girão Teixeira Lobo Barbosa (Porto, Sé, 9 January 1715 – Alijó, Vilar de Maçada), Fidalgo of the Royal Household and Knight of the Order of Christ.	Ele é descendente da filha ilegítima de António José Girão Teixeira Lobo Barbosa (Porto, Sé, 9 de janeiro de 1715 – Alijó, Vilar de Maçada), Fidalgo da Família Reak e Cavaleiro da Ordem de Cristo.
José Sócrates studied in Covilhã's basic and secondary schools, until the age of 18.	José Sócrates estudou nas escolas básicas e secundárias de Covilhã até os 18 anos.
Then, in 1975, he went to Coimbra in order to attend a higher education institution.	Então, em 1975, ele foi a Coimbra para participar de uma instituição de ensino superior.
He earned in 1979 his 4-year bacharelato degree as a civil technical engineer from the Instituto Superior de Engenharia de Coimbra (in 1988 incorporated into the Instituto Politécnico de Coimbra).	Em 1979, ele conquistou o diploma de bacharelado com duração de 4 anos de engenheiro técnico civil do Instituto Superior de Engenharia de Coimbra (incorporado em 1988 ao Instituto Politécnico de Coimbra).
From 1987 to 1993, he took law classes at Universidade Lusíada, a private university in Lisbon, but failed to graduate.	De 1987 a 1993, ele fez aulas na Universidade Lusíada, uma universidade privada em Lisboa, mas não conseguiu se formar.
In 1994/95, already a well-known politician, he briefly attended the Instituto Superior de Engenharia de Lisboa where he completed some academic disciplines in order to get a CESE diploma (a complementary diploma to his bacharelato degree because until 1999 the polytechnic institutions did not offer licenciatura degrees), but instead, under circumstances which would provoke a controversy in 2007, he earned in 1996 the licenciatura (licentiate degree) in civil engineering from the Universidade Independente, a private university in Lisbon which was shut down by Portuguese authorities in 2007/2008.	Em 1994/95, já uma figura política conhecida, ele frequentou o Instituto Superior de Engenharia de Lisboa onde concluiu algumas disciplinas acadêmicas para conseguir um diploma de CESE (um diploma complementar ao bacharelado, já que até 1999 as instituições politécnicas não ofereciam diplomas de licenciatura), mas, em vez disso, sob circunstâncias que provocariam uma controvérsia em 2007, ele conquistou em 1996 a licenciatura (diploma de licenciatura) em engenharia civil pela Universidade Independente, uma universidade privada em Lisboa que foi fechada por autoridades portuguesas em 2007/2008.
He also has an MBA degree awarded in 2005 by ISCTE, a public university institute in Lisbon, that he obtained after had attended successfully the first year of a 2-year master's degree program of ISCTE that he did not complete.	Ele também obteve um diploma de MBA em 2005 pela ISCTE, uma universidade pública em Lisboa, depois de frequentar com sucesso o primeiro ano de um mestrado de dois anos da ISCTE que ele não concluiu.
After his tenure as Prime Minister of Portugal ended in 2011, Sócrates and his elder son, moved to Paris where Sócrates attended the Institut d'Etudes Politiques de Paris (known as SciencesPo).	Depois que o mandato dele como primeiro-ministro de Portugal terminou em 2011, Sócrates e seu filho mais velho se mudaram para Paris, onde Sócrates frequentou o Institut d'Etudes Politiques de Paris (conhecido como SciencesPo).
In 2013, SciencesPo awarded him his master's degree in political science.	Em 2013, SciencesPo concedeu a ele o mestrado em ciências políticas.
His 2013 book Confiança do Mundo - Sobre a Tortura Em Democracia was based on his masters thesis there; however, there was some dispute as to its authorship.	O livro de 2013, Confiança do Mundo - Sobre a Tortura Em Democracia, teve base na tese de mestrado dele; no entanto, houve disputas com relação à autoria.
José Sócrates was one of the founders of JSD (the youth branch of PSD – Portuguese Social Democratic Party) before changing his political affiliation and applying for membership in the PS – Portuguese Socialist Party.	José Sócrates foi um dos fundadores do JSD (o braço jovem do PSD – Partido Social-Democrata Português) antes de mudar de afiliação política e unir-se ao PS – Partido Socialista Português.
He has been a member of the Socialist Party since 1981.	Ele era membro do Partido Socialista desde 1981.
José Sócrates served as a technical engineer for the Covilhã City Council, and has been elected a member of the Portuguese Parliament since 1987, representing the Castelo Branco electoral district.	José Sócrates serviu como engenheiro técnico no Conselho Municipal de Covilhã e é membro eleito do Parlamento Português desde 1987, representando o distrito eleitoral de Castelo Branco.
While serving as the chairperson of the Castelo Branco Federation of the Socialist Party (1983–1996), he was elected to the Party's National Secretariat in 1991.	Enquanto atuava como presidente da Federação de Castelo Branco do Partido Socialista (1983–1996), ele foi eleito secretário nacional do partido em 1991.
José Sócrates was ousted by the Board of the Guarda Municipality in 1990 and 1991, after being warned several times because of poor quality of construction projects and lack of monitoring of the construction works.	José Sócrates foi desapossado pela Diretoria da Guarda Municipal em 1990 e em 1991, depois de ser avisado várias vezes sobre a qualidade ruim dos projetos de construção e a falta de monitoramento das obras de construção.
Sócrates was threatened with disciplinary action for wrongdoings in the technical direction of particular works of whose projects he was the author, but despite being ousted from this capacity, he was never penalized.	Sócrates foi ameaçado com ações disciplinares por procedimentos indevidos na direção técnica de obras particulares cujos projetos eram dele, mas apesar de ser despossado desse cargo, ele nunca foi penalizado.
In addition, as a Member of the Parliament, Sócrates was not allowed by law to work as a technical engineer between 1987 and 1991.	Além disso, como membro do parlamento, Sócrates foi proibido por lei de trabalhar como engenheiro técnico entre 1987 e 1991.
From 1989 to 1996, he served as a member of the Covilhã Municipal Assembly.	De 1989 a 1996, ele serviu como membro da Assembleia Municipal de Covilhã.
He served as spokesperson on environmental affairs for the Socialist Party from 1991 to 1995.	Ele serviu como porta-voz para questões ambientais para o Partido Socialista de 1991 a 1995.
In 1995, he entered government as secretary of state for Environment in the first government of António Guterres.	Em 1995, ele entrou no governo como secretário de estado para Ambiente no primeiro governo de António Guterres.
Two years later, Sócrates became Minister for Youth and Sports and was one of the organizers of the EURO 2004 cup in Portugal.	Dois anos depois, Sócrates tornou-se ministro da Juventude e dos Esportes e foi um dos organizadores da copa EURO 2004 em Portugal.
He became Minister for Environment in Guterres' second government in 1999.	Ele tornou-se ministro do ambiente no segundo governo de Guterres em 1999.
Following the elections of 2002 (won by José Manuel Durão Barroso), Sócrates became a member of the opposition in the Portuguese Parliament.	Logo após as eleições de 2002 (vencidas por José Manuel Durão Barroso), Sócrates tornou-se membro da oposição no Parlamento português.
Meanwhile, he also had a program of political analysis, hosted jointly with Pedro Santana Lopes on RTP.	Enquanto isso, ele também tinha um programa de análise política, o qual apresentava junto com Pedro Santana Lopes na RTP.
After the resignation of Ferro Rodrigues as party leader in 2004, he won a bid for the post of secretary-general against Manuel Alegre and João Soares, winning the vote of nearly 80% of party members on 24 September 2004.	Após a renúncia de Ferro Rodrigues como líder do partido em 2004, ele venceu a disputa para o cargo de secretário-geral contra Manuel Alegre e João Soares, conquistando o voto de quase 80% dos membros do partido em 24 de setembro de 2004.
After the victory of his party in the 2005 Portuguese election, Sócrates was called on 24 February by president Jorge Sampaio to form a new government – the 17th Constitutional Government (after 1976).	Após a vitória do partido dele na eleição portuguesa de 2005, Sócrates foi chamado pelo presidente Jorge Sampaio em 24 de fevereiro para formar um novo governo – o 17º governo constitucional (depois de 1976).
After the Portuguese legislative election of 2009, held on 27 September 2009, José Sócrates was elected for a second term as Prime Minister of Portugal.	Após a eleição legislativa portuguesa de 2009, realizada em 27 de setembro de 2009, José Sócrates foi eleito para um segundo mandato como primeiro-ministro de Portugal.
He was also a Member of the Portuguese Council of State as the Prime-Minister.	Ele também foi membro do Conselho de Estado português como o primeiro-ministro.
Sócrates is divorced from Sofia Costa Pinto Fava, an engineer, with whom he has two sons, José Miguel Fava Pinto de Sousa (b. 1993) and Eduardo Fava Pinto de Sousa (b. 1995).	Sócrates é divorciado de Sofia Costa Pinto Fava, engenheira, com quem teve dois filhos, José Miguel Fava Pinto de Sousa (nascido em 1993) e Eduardo Fava Pinto de Sousa (nascido em 1995).
Sofia is a daughter of José Manuel Carvalho Fava, an architect, and Clotilde Mesquita (daughter of Armando Mesquita and Palmira da Costa Pinto), engineer and sister of Alexandre Mesquita Carvalho Fava and Mara Mesquita Carvalho Fava.	Sofia nasceu de José Manuel Carvalho Fava, arquiteto, e Clotilde Mesquita (filha de Armando Mesquita e Palmira da Costa Pinto), engenheira e irmã de Alexandre Mesquita Carvalho Fava e Mara Mesquita Carvalho Fava.
Sócrates lives in Lisbon, although he used to be a registered elector of the municipality of Covilhã, the place where he voted until the law was changed (since after the mid-2000s every person votes in one's residential area).	Sócrates vive em Lisboa, apesar de antes ser eleitor registrado do município de Covilhã, lugar onde votou até que a lei foi alterada (desde meados dos anos 2000, qualquer pessoa vota na área em que reside).
José Sócrates had photos of himself taken during his morning jog at places like the Red Square in Moscow, Rio de Janeiro's Copacabana, Luanda, and Lisbon.	José Sócrates saiu em fotos tiradas durante suas corridas matinais em locais como a Praça Vermelha em Moscou, Copacabana no Rio de Janeiro, Luanda e Lisboa.
In January 2008, a smoking ban came into force in Portugal's public buildings and on public transport, but Sócrates was reported to have been smoking in May during a private state flight to Venezuela where he met Hugo Chávez.	Em janeiro de 2008, entrou em vigor uma proibição de cigarro em edifícios públicos e no transporte público de Portugal, mas Sócrates foi denunciado por fumar em maio, durante um voo privado até a Venezuela, onde encontrou-se com Hugo Chávez.
He has since admitted it was a mistake, apologized and promised to quit smoking.	Desde então, ele admitiu que foi um erro, pediu desculpas e prometeu que deixaria de fumar.
In addition, he claimed he was not aware he was breaking the law when he did so.	Além disso, ele diz que não tinha consciência de que estava violando a lei .
However, by 2012, after he had left the spotlight, the Portuguese newspaper Diário de Notícias reported he was no longer a non-smoker.	No entanto, em 2012, após deixar os holofotes, o jornal português Diário de Notícias informou que ele já não era um ex-fumante.
After the Portuguese legislative election of 2005, Sócrates was called on 24 February by president Jorge Sampaio to form a new government.	Após a eleição legislativa portuguesa de 2005, Sócrates foi chamado em 24 de fevereiro pelo presidente Jorge Sampaio para formar um novo governo.
Sócrates and his first government (XVII Governo Constitucional) took office on 12 March 2005.	Sócrates e seu primeiro governo (XVII Governo Constitucional) tomou posse em 12 de março de 2005.
After the Portuguese legislative election of 2009, held on 27 September 2009, José Sócrates was elected for a second term as Prime Minister of Portugal.	Após a eleição legislativa portuguesa de 2009, realizada em 27 de setembro de 2009, José Sócrates foi eleito para um segundo mandato como primeiro-ministro de Portugal.
The new government was sworn into office on 26 October 2009.	O novo governo assumiu o comando em 26 de outubro de 2009.
On 5 June 2011, after the Portuguese legislative election of 2011, the victory of Social Democratic Party (Portuguese: Partido Social Democrata) led by Pedro Passos Coelho, forced his resignation as Secretary-General of the Socialist Party.	Em 5 de junho de 2011, após a eleição legislativa portuguesa de 2011, a vitória do Partido Social-Democrata (português: Partido Social-Democrata) conduzida por Pedro Passos Coelho, forçou sua renúncia como secretário-geral do Partido Socialista.
Sócrates headed the government beginning on 12 March 2005, comprising the XVII and XVIII Governos Constitucionais (17th and 18th Constitutional Governments).	Sócrates liderou o governo a partir de 12 de março de 2005, formando os XVII e XVIII Governos Constitucionais (17º e 18º Governos Constitucionais).
The XVII Governo Constitucional government, headed by Prime Minister José Sócrates, tried to create new rules and implement reforms aiming at better efficiency and rationalized resource allocation in the public sector, fighting civil servant overcapacity (excedentários) and reducing bureaucracy for both citizens and companies (e.g.: empresa na hora, PRACE – Programa de Reestruturação da Administração Central do Estado, and SIMPLEX – Programa de Simplificação Administrativa e Legislativa), among others.	O XVII Governo Constitucional, liderado pelo primeiro-ministro José Sócrates, tentou criar novas regras e implementar reformas com o objetivo de melhorar a eficiência e racionalizar a alocação de recursos no setor público, combater o excesso de servidores civis (excedentários) e reduzir a burocracia para cidadãos e empresas (por exemplo: empresa na hora, PRACE – Programa de Reestruturação da Administração Central do Estado e SIMPLEX – Programa de Simplificação Administrativa e Legislativa), entre outros.
Since the XVII Governo Constitucional government (with José Sócrates as Prime Minister and Teixeira dos Santos as Minister of Finance) Portugal's fiscal policy improved with a steady increase of the number of taxpayers and the growth of the receipt amount from State taxation.	Desde o XVII Governo Constitucional (com José Sócrates como primeiro-ministro e Teixeira dos Santos como ministro das finanças) a política fiscal de Portugal melhorou com um aumento contínuo do número de pagadores de impostos e o crescimento da receita com a tributação do estado.
However these policies had little effect, and the country's public debt and deficit were both out of control by 2010, along with a record high unemployment rate.	No entanto, essas políticas tiveram pouco efeito e a dívida pública e o déficit do país saíram do controle em 2010, acompanhados de uma alta taxa de desemprego.
João Bilhim directed in 2005 the committee responsible for the Programme for Restructuring the State's Central Administration (PRACE) but was said to be disappointed with the results.	Em 2005, João Bilhim dirigiu o comitê responsável pelo Programa de Reestruturação da Administração Central do Estado (PRACE), mas dizem que ficou desapontado com os resultados.
Several reforms and measures implemented in 2006/2007 by the government (XVII Governo Constitucional – headed by Prime Minister José Sócrates), resulted in improved welfare system financial sustainability but reduced income expectations of future pensioners up to 40%.	Diversas reformas e medidas implementadas em 2006/2007 pelo governo (XVII Governo Constitucional, liderado pelo primeiro-ministro José Sócrates), resultaram no aprimoramento da sustentabilidade financeira do sistema de bem-estar social, mas reduziram as expectativas de receita de pensionistas futuros em até 40%.
In addition, economically active people must work for more years before retirement than formerly.	Além disso, as pessoas economicamente ativas devem trabalhar por mais anos do que antes até se aposentarem.
A sustainability factor was also introduced, giving employees the option of working longer or receiving slightly lower pensions, as life expectancy forecasts increase.	Um fator de sustentabilidade também foi introduzido, proporcionando aos funcionários a opção de trabalhar por mais tempo ou receber pensões ligeiramente menores, já que as previsões de expectativa de vida aumentaram.
