A mobile phone, cell phone, cellphone, or hand phone, sometimes shortened to simply mobile, cell or just phone, is a portable telephone that can make and receive calls over a radio frequency link while the user is moving within a telephone service area.	Um telefone móvel, telefone celular, telefone portátil, muitas vezes chamado apenas de celular ou de telefone, é um telefone portátil que faz e recebe chamadas através de um canal de rádio, quando o usuário está na área de cobertura da operadora.
The radio frequency link establishes a connection to the switching systems of a mobile phone operator, which provides access to the public switched telephone network (PSTN).	O link da frequência de rádio estabelece uma conexão com os sistemas variáveis de uma operadora de celular, o que dá acesso à rede pública de telefonia.
Modern mobile telephone services use a cellular network architecture, and, therefore, mobile telephones are called cellular telephones or cell phones, in North America.	Os serviços modernos de telefonia celular usam uma arquitetura telefônica celular, e, assim, telefones portáteis são chamados de telefones celulares ou "cell phones" na América do Norte.
In addition to telephony, 2000s-era mobile phones support a variety of other services, such as text messaging, MMS, email, Internet access, short-range wireless communications (infrared, Bluetooth), business applications, video games, and digital photography.	Além da telefonia, os aparelhos dos anos 2000 fornecem uma variedade de outros serviços, como mensagens de texto, MMS, e-mail, acesso à internet, comunicação sem fio de curto alcance (infravermelho, bluetooth), aplicativos de negócios, videogames e fotografia digital.
Mobile phones offering only those capabilities are known as feature phones; mobile phones which offer greatly advanced computing capabilities are referred to as smartphones.	Telefones celulares que oferecem esses outros serviços são chamados de "feature phones", os que têm capacidades de computação ainda mais avançadas são chamados de smartphones.
The first handheld mobile phone was demonstrated by John F. Mitchell and Martin Cooper of Motorola in 1973, using a handset weighing c.	O primeiro telefone portátil foi apresentado por John F. Mitchell e Martin Cooper, da Motorola, em 1973, usando um aparelho que pesava
2 kilograms (4.4 lbs).	2 quilos (4,4 lbs).
In 1979, Nippon Telegraph and Telephone (NTT) launched the world's first cellular network in Japan.	Em 1979, a Nippon Telegraph e Telephone (NTT), criou a primeira rede de telefonia celular do mundo, no Japão.
In 1983, the DynaTAC 8000x was the first commercially available handheld mobile phone.	Em 1983 surgiu o DynaTAC 8000x, o primeiro telefone portátil disponível comercialmente.
From 1983 to 2014, worldwide mobile phone subscriptions grew to over seven billion—enough to provide one for every person on Earth.	Entre 1983 e 2014, as assinaturas de telefones celulares chegaram a sete bilhões, o suficiente para um por habitante da Terra.
In first quarter of 2016, the top smartphone developers worldwide were Samsung, Apple, and Huawei, and smartphone sales represented 78 percent of total mobile phone sales.	No primeiro trimestre de 2016, os maiores desenvolvedores de smartphones no mundo eram a Samsung, a Apple e a Huawei, e as vendas de smartphones representavam 78% das vendas totais de telefones.
For feature phones (slang: “dumbphones”) as of 2016, the largest were Samsung, Nokia, and Alcatel.	Para features phones, (gíria: "dumbphones"), desde 2016, os maiores fabricantes eram a Samsung, a Nokia e a Alcatel.
A handheld mobile radio telephone service was envisioned in the early stages of radio engineering.	Um serviço de telefonia via rádio móvel portátil foi imaginado nos primeiros estágios da engenharia de rádio.
In 1917, Finnish inventor Eric Tigerstedt filed a patent for a "pocket-size folding telephone with a very thin carbon microphone".	Em 1917, o inventor finlandês Eric Tigerstedt apresentou uma patente para um "telefone de bolso dobrável com um microfone de carbono muito fino".
Early predecessors of cellular phones included analog radio communications from ships and trains.	Os precursores iniciais dos telefones celulares foram as comunicações analógicas de navios e trens via rádio.
The race to create truly portable telephone devices began after World War II, with developments taking place in many countries.	A corrida para criar dispositivos de telefonia verdadeiramente portáteis começou após a Segunda Guerra Mundial, com desenvolvimentos ocorrendo em muitos países.
The advances in mobile telephony have been traced in successive "generations", starting with the early zeroth-generation (0G) services, such as Bell System's Mobile Telephone Service and its successor, the Improved Mobile Telephone Service.	Os progressos na telefonia móvel foram traçados em "gerações" sucessivas, iniciando com os primeiros serviços da geração-zero (0G), como o Serviço de Telefonia Móvel da Bell System e seu sucessor, o Serviço de Telefonia Móvel Aprimorado.
These 0G systems were not cellular, supported few simultaneous calls, and were very expensive.	Esses sistemas 0G não eram celulares, suportavam algumas chamadas simultâneas e eram muito caros.
The first handheld cellular mobile phone was demonstrated by John F. Mitchell and Martin Cooper of Motorola in 1973, using a handset weighing 2 kilograms (4.4 lb).	O primeiro telefone móvel celular portátil foi demonstrado por John F. Mitchell e Martin Cooper da Motorola em 1973, usando um aparelho que pesava 2 quilogramas (4,4 lb).
The first commercial automated cellular network (1G) analog was launched in Japan by Nippon Telegraph and Telephone in 1979.	A primeira rede celular automatizada comercial (1G) analógica foi iniciada no Japão pela Nippon Telegraph and Telephone em 1979.
This was followed in 1981 by the simultaneous launch of the Nordic Mobile Telephone (NMT) system in Denmark, Finland, Norway, and Sweden.	Isso foi seguido, em 1981, pelo lançamento simultâneo do sistema Nordic Mobile Telephone (NMT) na Dinamarca, Finlândia, Noruega e Suécia.
Several other countries then followed in the early to mid-1980s.	Depois, vários outros países acompanharam nos primeiros anos a meados da década de 1980.
These first-generation (1G) systems could support far more simultaneous calls but still used analog cellular technology.	Esses sistemas de primeira geração (1G) podiam suportar bem mais chamadas simultâneas, mas ainda usavam tecnologia celular analógica.
In 1983, the DynaTAC 8000x was the first commercially available handheld mobile phone.	Em 1983, o DynaTAC 8000x foi o primeiro telefone móvel portátil comercialmente disponível.
Digital cellular networks first appeared in the 1990s, enabled by the wide adoption of MOSFET-based RF power amplifiers (power MOSFET and LDMOS) and RF circuits (RF CMOS).	As redes celulares digitais surgiram pela primeira vez nos anos 1990, possibilitadas pela grande adoção de amplificadores com potência RF baseados em MOSFET (potência MOSFET e LDMOS) e circuitos RF (RF CMOS).
In 1991, the second-generation (2G) digital cellular technology was launched in Finland by Radiolinja on the GSM standard.	A tecnologia digital celular 2G (segunda geração) foi lançada na Finlândia pela Radiolinja no padrão GSM em 1991.
This sparked competition in the sector as the new operators challenged the incumbent 1G network operators.	Isso desencadeou a concorrência no setor conforme novas operadoras desafiaram as operadoras de rede 1G estabelecidas.
Ten years later, in 2001, the third generation (3G) was launched in Japan by NTT DoCoMo on the WCDMA standard.	Em 2001, dez anos depois, o 3G (terceira geração) foi lançado no Japão pela NTT DoCoMo no padrão WCDMA.
This was followed by 3.5G, 3G+ or turbo 3G enhancements based on the high-speed packet access (HSPA) family, allowing UMTS networks to have higher data transfer speeds and capacity.	Depois disso vieram os aprimoramentos 3.5G, 3G+ ou 3G turbo baseados na família de acesso de pacote de alta velocidade (HSPA), permitindo que as redes UMTS tivessem capacidade e velocidades de transferência de dados mais altas.
By 2009, it had become clear that, at some point, 3G networks would be overwhelmed by the growth of bandwidth-intensive applications, such as streaming media.	Em 2009, havia ficado claro que, em algum ponto, as redes 3G ficariam sobrecarregadas pelo crescimento de aplicativos que consomem muita largura de banda, como o streaming de mídia.
Consequently, the industry began looking to data-optimized fourth-generation technologies, with the promise of speed improvements up to ten-fold over existing 3G technologies.	Consequentemente, o setor começou a se voltar para tecnologias de quarta geração com dados otimizados, com a promessa de acelerar os aprimoramentos até dez vezes em relação às tecnologias 3G existentes.
The first two commercially available technologies billed as 4G were the WiMAX standard, offered in North America by Sprint, and the LTE standard, first offered in Scandinavia by TeliaSonera.	As duas primeiras tecnologias comercialmente disponíveis anunciadas como 4G foram o padrão WiMAX, oferecido na América do Norte pela Sprint, e o padrão LTE, oferecido primeiro na Escandinávia pela TeliaSonera.
5G is a technology and term used in research papers and projects to denote the next major phase in mobile telecommunication standards beyond the 4G/IMT-Advanced standards.	O 5G é uma tecnologia e termo usados em trabalhos de pesquisa e projetos para indicar a próxima grande fase nos padrões de telecomunicação móvel além dos padrões 4G/IMT-Advanced.
The term 5G is not officially used in any specification or official document yet made public by telecommunication companies or standardization bodies such as 3GPP, WiMAX Forum or ITU-R. New standards beyond 4G are currently being developed by standardization bodies, but they are at this time seen as under the 4G umbrella, not for a new mobile generation.	O termo 5G não é usado oficialmente em nenhuma especificação ou documento oficial já tornado público pelas empresas de telecomunicação ou entidades padronizadoras como 3GPP, WiMAX Forum ou ITU-R. Novos padrões além do 4G estão atualmente sendo desenvolvidos pelas entidades padronizadoras, mas no momento, eles são vistos como estando sob o guarda-chuva 4G, não como uma nova geração móvel.
Smartphones have a number of distinguishing features.	Smartphones têm algumas características marcantes.
The International Telecommunication Union measures those with Internet connection, which it calls Active Mobile-Broadband subscriptions (which includes tablets, etc.). In the developed world, smartphones have now overtaken the usage of earlier mobile systems.	A União Internacional de Telecomunicações os avalia com conexâo com a Internet, que chama de assinaturas assinaturas ativas de banda larga móvel (o que inclui tablets etc.). No mundo desenvolvido, smartphones superaram o uso dos primeiros sistemas móveis.
However, in the developing world, they account for around 50% of mobile telephony.	No entanto, no mundo em desenvolvimento, eles são responsáveis por cerca de 50% da telefonia móvel.
Feature phone is a term typically used as a retronym to describe mobile phones which are limited in capabilities in contrast to a modern smartphone.	Feature phone é um termo geralmente usado como retrônimo para descrever telefones móveis com recursos limitados em comparação com um smartphone moderno.
Feature phones typically provide voice calling and text messaging functionality, in addition to basic multimedia and Internet capabilities, and other services offered by the user's wireless service provider.	Os Feature phones geralmente fornecem as funcionalidades de chamada de voz e mensagem de texto, além de recursos básicos de multimídia e Internet, e outros serviços oferecidos pela operadora de serviços sem fio do usuário.
A feature phone has additional functions over and above a basic mobile phone which is only capable of voice calling and text messaging.	Um Feature phone tem mais funções que um telefone celular básico, que só tem capacidade para chamadas de voz e mensagens de texto.
Feature phones and basic mobile phones tend to use a proprietary, custom-designed software and user interface.	Os Feature phones e os telefones celulares básicos tendem a usar software e interface de usuário proprietários e personalizados.
By contrast, smartphones generally use a mobile operating system that often shares common traits across devices.	Em contrapartida, smartphones geralmente utilizam um sistema operacional celular que com frequência compartilha características comuns entre dispositivos.
There are Orthodox Jewish religious restrictions which, by some interpretations, standard mobile telephones overstep.	Existem algumas restrições religiosas judaico ortodoxas que, em algumas interpretações, os telefones celulares padrão ultrapassam.
To deal with this problem, some rabbinical organizations have recommended that phones with text-messaging capability not be used by children.	Para lidar com esse problema, algumas organizações rabínicas recomendaram que telefones com o recurso de mensagem de texto não fossem usados por crianças.
Phones with restricted features are known as kosher phones and have rabbinical approval for use in Israel and elsewhere by observant Orthodox Jews.	Telefones com recursos restritos são conhecidos como telefones kosher e têm aprovação rabínica para uso em Israel e em outros lugares por judeus ortodoxos praticantes.
Although these phones are intended to prevent immodesty, some vendors report good sales to adults who prefer the simplicity of the devices.	Embora esses telefones sejam destinados a prevenir a idolatria, alguns fornecedores relatam boas vendas para adultos que preferem a simplicidade do dispositivo.
Some phones are approved for use by essential workers (such as health, security, and public service workers) on the sabbath, even though the use of any electrical device is generally prohibited during this time.	Alguns telefones são aprovados para uso por trabalhadores essenciais (por exemplo, trabalhadores da saúde, da segurança e do serviço público) no sabbath, mesmo que o uso de qualquer dispositivo elétrico em geral seja proibido durante esse período.
Mobile phones communicate with cell towers that are placed to give coverage across a telephone service area which is divided up into 'cells'.	Os telefones celulares se comunicam com torres celulares que são posicionadas de modo a dar cobertura entre uma área de serviço de telefonia que está dividida em 'células'.
Each cell uses a different set of frequencies from neighboring cells, and will typically be covered by 3 towers placed at different locations.	Cada célula usa um conjunto diferente de frequências das células vizinhas, e geralmente será coberta por 3 torres posicionadas em locais diferentes.
The cell towers are usually interconnected to each other and the phone network and the internet by wired connections.	As torres celulares geralmente são interconectadas entre si e a rede de telefonia e a Internet por conexões cabeadas.
Due to bandwidth limitations each cell will have a maximum number of cell phones it can handle at once.	Devido a limitações de largura de banda, cada célula terá um número máximo de telefones celulares que pode administrar de cada vez.
The cells are therefore sized depending on the expected usage density, and may be much smaller in cities.	Assim, as células são dimensionadas de acordo com a densidade de uso esperada e podem ser muito menores nas cidades.
In that case much lower transmitter powers are used to avoid broadcasting beyond the cell.	Nesse caso, potências emissoras muito menores são usadas para evitar transmissão além da célula.
In order to handle the high traffic, multiple towers can be setup in the same area(using different frequencies).	Para administrar o alto tráfego, várias torres podem ser configuradas na mesma área (usando frequências diferentes).
This can be done permanently or temporarily such as at special events like at the Super Bowl, Taste of Chicago, State Fair, NYC New Year's Eve, hurricane hit cities, etc.	Isso pode ser feito de modo permanente ou temporário, por exemplo, em eventos especiais como Super Bowl, Taste of Chicago, State Fair, NYC New Year's Eve, cidades atingidas por furacões etc.
where cell phone companies will bring a truck with equipment to host the abnormally high traffic with a portable cell.	onde empresas de telefonia celular levarão um caminhão com equipamentos para suprir o tráfego anormalmente alto com uma célula portátil.
Cellular can greatly increase the capacity of simultaneous wireless phone calls.	O celular pode aumentar bastante a capacidade de chamadas telefônicas simultâneas sem fio.
While a phone company for example, has a license to 1000 frequencies, each cell must use unique frequencies with each call using one of them when communicating.	Embora uma empresa de telefonia, por exemplo, tenha uma licença para 1000 frequências, cada célula precisa usar frequências únicas a cada chamada utilizando uma delas durante a comunicação.
Because cells only slightly overlap, the same frequency can be reused.	Como as células somente se sobrepõem ligeiramente, a mesma frequência pode ser reutilizada.
Example cell 1 uses frequency 1-500, next door cell uses frequency 501-1000, next door can reuse frequency 1-500.	A célula de exemplo 1 usa a frequência 1-500, a célula ao lado usa a frequência 501-1000, a próxima pode reutilizar a frequência 1-500.
Cells 1 and 3 are not "touching" and do not overlap\communicate so each can reuse the same frequencies.	As células 1 e 3 não estão se "tocando" e não se sobrepõem\comunicam, assim, cada uma delas pode reutilizar as mesmas frequências.
This is even more greatly increased when phone companies implemented digital networks.	Isso aumentou ainda mais quando as empresas de telefonia implementaram as redes digitais.
With digital, one frequency can host multiple simultaneous calls increasing capacity even more.	Com o digital, uma frequência pode hospedar várias chamadas simultâneas aumentando a capacidade ainda mais.
As a phone moves around, a phone will "hand off" - automatically disconnect and reconnect to the tower of another cell that gives the best reception.	Conforme o telefone se move, um aparelho "desligará" - se desconectará automaticamente e se reconectará à torre de outra célula que fornecer a melhor recepção.
Additionally, short-range Wi-Fi infrastructure is often used by smartphones as much as possible as it offloads traffic from cell networks on to local area networks.	Além disso, a infraestrutura de Wi-Fi de curta distância frequentemente é usada pelos smartphones o máximo possível, pois alivia o tráfego das redes celulares para as redes de área local.
Mobile phones have central processing units (CPUs), similar to those in computers, but optimised to operate in low power environments.	Os telefones celulares têm unidades de processamento central (CPUs), parecidas com as de computadores, mas otimizadas para operar em ambientes de menos potência.
Mobile CPU performance depends not only on the clock rate (generally given in multiples of hertz) but also the memory hierarchy also greatly affects overall performance.	O desempenho da CPU móvel depende não só da taxa de clock (geralmente atribuída em múltiplos de hertz), como também a hierarquia de memória afeta grandemente o desempenho geral.
Because of these problems, the performance of mobile phone CPUs is often more appropriately given by scores derived from various standardized tests to measure the real effective performance in commonly used applications.	Devido a esses problemas, o desempenho das CPUs de telefones celulares com frequência é atribuído mais apropriadamente por pontuações obtidas de vários testes padronizados para medir o desempenho efetivo real em aplicações comumente usadas.
One of the main characteristics of phones is the screen.	Uma das características principais dos telefones é a tela.
Depending on the device's type and design, the screen fills most or nearly all of the space on a device's front surface.	Dependendo do tipo e do design do dispositivo, a tela ocupa a maior parte ou quase todo o espaço da superfície frontal de um dispositivo.
Many smartphone displays have an aspect ratio of 16:9, but taller aspect ratios became more common in 2017.	As telas de muitos smartphones têm uma razão de aspecto de 16:9, mas razões de aspecto mais altas ficaram mais comuns em 2017.
Screen sizes are measured in diagonal inches; feature phones generally have screen sizes below 3.5 inches.	Os tamanhos de telas são medidos na diagonal em polegadas; Feature phones geralmente têm tamanhos de tela abaixo de 3,5 polegadas.
Phones with screens larger than 5.2 inches are often called "phablets." Smartphones with screens over 4.5 inches in size are commonly difficult to use with only a single hand, since most thumbs cannot reach the entire screen surface; they may need to be shifted around in the hand, held in one hand and manipulated by the other, or used in place with both hands.	Telefones com telas maiores do que 5,2 polegadas com frequência são chamados de "fabletes". Smartphones com telas de mais de 4,5 polegadas geralmente são difíceis de usar com apenas uma das mãos, já que muitos polegares não conseguem alcançar toda a superfície da tela; talvez eles precisem ser deslocados pela mão, segurados com uma das mãos e manipulados com a outra, ou usados apoiados com as duas mãos.
Due to design advances, some modern smartphones with large screen sizes and "edge-to-edge" designs have compact builds that improve their ergonomics, while the shift to taller aspect ratios have resulted in phones that have larger screen sizes whilst maintaining the ergonomics associated with smaller 16:9 displays.	Graças aos avanços de projeto, alguns smartphones modernos com tamanhos de tela grandes e designs de "borda infinita" têm construções compactas que melhoram sua ergonomia, embora a mudança para razões de aspecto mais altas tenha resultado em telefones com tamanhos de tela maiores ao mesmo tempo em que foi mantida a ergonomia associada a telas menores de 16:9.
Liquid-crystal displays are the most common; others are IPS, LED, OLED, and AMOLED displays.	As telas de cristal líquido são as mais comuns; outras são telas IPS, LED, OLED e AMOLED.
Some displays are integrated with pressure-sensitive digitizers, such as those developed by Wacom and Samsung, and Apple's "3D Touch" system.	Algumas telas são integradas com leitores de digital sensíveis à pressão, como aqueles desenvolvidos pela Wacom e Samsung, e o sistema "3D Touch" da Apple.
In sound, smartphones and feature phones vary little.	O som de smartphones e feature phones tem poucas diferenças.
Some audio-quality enhancing features, such as Voice over LTE and HD Voice, have appeared and are often available on newer smartphones.	Alguns recursos de aprimoramento da qualidade do áudio, como Voice over LTE e HD Voice, surgiram e com frequência estão disponíveis nos smartphones mais novos.
Sound quality can remain a problem due to the design of the phone, the quality of the cellular network and compression algorithms used in long distance calls.	A qualidade do som pode permanecer um problema devido ao design do telefone, à qualidade da rede celular e aos algoritmos de compactação usados nas chamadas de longa distância.
Audio quality can be improved using a VoIP application over WiFi.	A qualidade do áudio pode ser melhorada com o uso de um aplicativo VoIP sobre WiFi.
Cellphones have small speakers so that the user can use a speakerphone feature and talk to a person on the phone without holding it to their ear.	Telefones celulares têm pequenos celulares para que o usuário possa utilizar um recurso de viva-voz e falar com uma pessoa no telefone sem segurá-lo perto do ouvido.
The small speakers can also be used to listen to digital audio files of music or speech or watch videos with an audio component, without holding the phone close to the ear.	Os pequenos alto-falantes também podem ser usados para ouvir arquivos de áudio digital de música ou palestras ou assistir a vídeos com um componente de áudio, sem segurar o telefone perto do ouvido.
The average phone battery lasts 2–3 years at best.	A bateria de telefone comum dura 2–3 anos no máximo.
Many of the wireless devices use a Lithium-Ion (Li-Ion) battery, which charges 500-2500 times, depending on how users take care of the battery and the charging techniques used.	Muitos dos dispositivos sem fio usam uma bateria de íon de lítio (Li-Ion), que carrega 500-2500 vezes, dependendo de como os usuários cuidam da bateria e das técnicas de carregamento usadas.
It is only natural for these rechargeable batteries to chemically age, which is why the performance of the battery when used for a year or two will begin to deteriorate.	É natural que essas baterias recarregáveis envelheçam quimicamente, é por isso que o desempenho da bateria quando usada por um ano ou dois começará a se deteriorar.
Battery life can be extended by draining it regularly, not overcharging it, and keeping it away from heat.	A vida útil da bateria pode ser estendida esgotando-a regularmente, não carregando-a em excesso e mantendo-a longe do calor.
Mobile phones require a small microchip called a Subscriber Identity Module or SIM card, in order to function.	Os telefones celulares requerem um pequeno microchip chamado de Subscriber Identity Module ou cartão  SIM, para funcionar.
