At about the same time, self-propelled multiple unit vehicles (both diesel and electric) became much more widely used in passenger service.	Aproximadamente ao mesmo tempo, veículos de unidades múltiplas autopropelidos (tanto a diesel quanto elétricos) se tornaram muito mais amplamente utilizados no serviço para passageiros.
Dieselization of locomotives in day-to-day use was completed in most countries by the 1970s.	A dieselização das locomotivas no uso diário foi concluída na maioria dos países até os anos 1970.
Steam locomotives are still used in heritage railways which are operated in many countries for the leisure and enthusiast market.	As locomotivas a vapor ainda são usadas em ferrovias antigas operadas em muitos países para o mercado de lazer e entusiastas.
Electric traction offers a lower cost per mile of train operation but at a higher initial cost, which can only be justified on high traffic lines.	A tração elétrica oferece um custo menor por milha de operação ferroviária, mas a um custo inicial mais alto, que só pode ser justificado em linhas de tráfego alto.
Even though the cost per mile of construction is much higher, electric traction is more viable during operation because diesel import costs are substantially higher.	Mesmo que o custo por milha de construção seja muito mais alto, a tração elétrica é mais viável durante a operação porque os custos de importação do diesel são substancialmente mais altos.
Electric trains receive their current via overhead lines or through a third rail electric system.	Os trens elétricos recebem sua corrente via linhas aéreas ou por meio de um terceiro sistema elétrico ferroviário.
Lesser used locomotives are: gas turbine locomotive and fuel cell locomotives, which combine the advantage of not needing an electrical system in place, with the advantage of emissionless operation.	As locomotivas menos usadas são: locomotiva de turbina a gás e locomotivas de célula a combustível, que combinam a vantagem de não precisar de um sistema elétrico no local com a vantagem de operação sem emissão.
However, there is a substantial initial cost associated with fuel cell vehicles.	No entanto, existe um custo inicial substancial associado a veículos de célula a combustível.
A passenger train includes passenger-carrying vehicles and can often be very long and fast.	Um trem de passageiros inclui carros de transporte de passageiros e frequentemente pode ser muito longo e rápido.
It may be a self-powered multiple unit or railcar, or else a combination of one or more locomotives and one or more unpowered trailers known as coaches, cars or carriages.	Ele pode ser uma unidade múltiplas autoalimentada ou vagão ou ainda uma combinação de uma ou mais locomotivas e um ou mais reboques sem energia conhecidos como vagões, carros ou carruagens.
Passenger trains travel between stations or depots, where passengers may board and disembark.	Os trens de passageiros viajam entre estações ou entrepostos, onde os passageiros podem embarcar ou desembarcar.
In most cases, passenger trains operate on a fixed schedule and have superior track occupancy rights over freight trains.	Na maioria dos casos, os trens de passageiros operam em horários fixos e têm direitos superiores de ocupação de pista em relação aos trens de carga.
Unlike freight trains, passenger trains must supply head-end power to each coach for lighting and heating, among other purposes.	Diferentemente dos trens de carga, os trens de passageiros precisam fornecer potência de ponta a cada vagão para iluminação e aquecimento, entre outras finalidades.
This can be drawn directly from the locomotive's prime mover (modified for the purpose), or from a separate diesel generator in the locomotive.	Ela pode ser obtida diretamente do motor principal da locomotiva (modificado para esse fim) ou de um gerador a diesel separado na locomotiva.
For passenger service on remote routes where a head-end-equipped locomotive may not always be available, a separate generator van may be used.	Para serviço de passageiros em rotas remotas onde uma locomotiva com potência de ponta talvez nem sempre esteja disponível, um vagão gerador de energia separado pode ser usado.
Oversight of a passenger train is the responsibility of the conductor.	A supervisão de um trem de passageiros é responsabilidade do maquinista.
He or she is sometimes assisted by other crew members, such as service attendants or porters.	Às vezes, ele ou ela é ajudado(a) por outros membros da tripulação, como atendentes ou carregadoras.
During the heyday of North American passenger rail travel, long distance trains carried two conductors: the aforementioned train conductor, and a Pullman conductor, the latter being in charge of sleeping car personnel.	No auge das viagens ferroviárias de passageiros norte-americanos, os trens de longa distância transportavam dois condutores: o já mencionado maquinista e um condutor Pullman, este último estando no comando do pessoal do vagão-dormitório.
Many prestigious passenger train services have been given a specific name, some of which have become famous in literature and fiction.	Muitos serviços renomados de trens de passageiros receberam um nome específico, alguns dos quais ficaram famosos na literatura e na ficção.
In past years, railroaders often referred to passenger trains as the "varnish", alluding to the bygone days of wooden-bodied coaches with their lustrous exterior finishes and fancy livery.	Antigamente, ferroviários frequentemente se referiam aos trens de passageiros como o "verniz", em alusão aos dias passados de vagões de madeira com seus acabamentos externos brilhantes e uniformes elegantes.
"Blocking the varnish" meant a slow-moving freight train was obstructing a fast passenger train, causing delays.	"Bloquear o verniz" significava que um trem de carga lento estava obstruindo um trem de passageiros mais rápido, causando atrasos.
Some passenger trains, both long distance and short distance, may use bi-level (double-decker) cars to carry more passengers per train.	Alguns trens de passageiros, tanto de longa quanto de curta distância, podem usar vagões binível (de dois andares) para transportar mais passageiros por trem.
Car design and the general safety of passenger trains have dramatically evolved over time, making travel by rail remarkably safe.	O design do vagão e a segurança geral dos trens de passageiros evoluíram radicalmente com o tempo, tornando as viagens ferroviárias notavelmente seguras.
Long-distance trains travel between many cities and/or regions of a country, and sometimes cross several countries.	Os trens de longa distância percorrem muitas cidades e/ou regiões de um país e, às vezes, atravessam vários países.
They often have a dining car or restaurant car to allow passengers to have a meal during the course of their journey.	Com frequência, eles têm um carro-restaurante ou vagão-restaurante para permitir que os passageiros façam uma refeição no decorrer do trajeto.
Trains travelling overnight may also have sleeping cars.	Trens que viajam durante a noite também podem ter vagões-dormitório.
Currently much of travel on these distances of over 500 miles (800 km) is done by air in many countries but in others long-distance travel by rail is a popular or the only cheap way to travel long distances.	Atualmente, grande parte das viagens acima de 500 milhas (800 km) é feita pelo ar em muitos países, mas em outros, viagens de longa distância por trem são um jeito popular ou a única forma barata de percorrer longas distâncias.
One notable and growing long-distance train category is high-speed rail.	Uma categoria de trem de longa distância notável e que está crescendo é a ferrovia de alta velocidade.
Generally, high-speed rail runs at speeds above 200 km/h (120 mph) and often operates on dedicated track that is surveyed and prepared to accommodate high speeds.	Em geral, as velocidades das ferrovias de alta velocidade ficam acima de 200 km/h (120 mph) e frequentemente elas operam em trilhos dedicados pesquisados e preparados para acomodar altas velocidades.
Japan's Shinkansen (popularly known as the "bullet train") commenced operation in 1964, and was the first successful example of a high-speed passenger rail system.	O Shinkansen japonês (popularmente conhecido como "trem-bala") começou a operar em 1964 e foi o primeiro exemplo bem-sucedido de um sistema ferroviário de passageiros de alta velocidade.
The fastest wheeled train running on rails is France's TGV (Train à Grande Vitesse, literally "high speed train"), which achieved a speed of 574.8 km/h (357.2 mph), twice the takeoff speed of a Boeing 727 jetliner, under test conditions in 2007. The highest speed currently attained in scheduled revenue operation is 350 km/h (220 mph) on the Beijing–Tianjin Intercity Rail and Wuhan–Guangzhou High-Speed Railway systems in China.	O trem de rodas mais rápido rodando nas ferrovias é o TGV da França (Train à Grande Vitesse, literalmente "trem de alta velocidade"), que atingiu uma velocidade de 574,8 km/h (357,2 mph), o dobro da velocidade de decolagem de um Boeing 727, em condições de teste em 2007. A velocidade mais alta obtida até hoje na operação de rendimento programado foi 350 km/h (220 mph) na Ferrovia Intermunicipal Beijing–Tianjin e nos sistemas ferroviários de alta velocidade Wuhan–Guangzhou na China.
The TGV runs at a maximum revenue speed of 300–320 km/h (190–200 mph), as does Germany's Inter-City Express and Spain's AVE (Alta Velocidad Española).	O TGV roda em uma velocidade de rendimento máxima de 300–320 km/h (190–200 mph), assim como o Inter-City Express da Alemanha e o AVE (Alta Velocidad Española) da Espanha.
In most cases, high-speed rail travel is time- and cost-competitive with air travel when distances do not exceed 500 to 600 km (310 to 370 mi), as airport check-in and boarding procedures may add as many as two hours to the overall transit time.	Na maioria dos casos, viagens de alta velocidade são eficientes em termos de tempo e custo com viagens aéreas quando as distâncias não excedem 500 a 600 km (310 a 370 mi), pois o check-in no aeroporto e os procedimentos de embarque podem agregar até duas horas ao tempo geral de trânsito.
Also, rail operating costs over these distances may be lower when the amount of fuel consumed by an airliner during takeoff and climbout is considered.	Além disso, os custos operacionais de ferrovias nessas distâncias podem ser inferiores quando a quantidade de combustível consumida por um avião na decolagem e aterrisagem é considerada.
As travel distance increases, the latter consideration becomes less of the total cost of operating an airliner and air travel becomes more cost-competitive.	Conforme a distância de viagem aumenta, a última consideração se torna menos do custo total de operação de um avião e a viagem aérea se torna mais eficiente em termos de custo.
Some high-speed rail equipment employs tilting technology to improve stability in curves.	Alguns equipamentos ferroviários de alta velocidade empregam tecnologia de basculante para melhorar a estabilidade nas curvas.
Examples of such equipment are the Advanced Passenger Train (APT), the Pendolino, the N700 Series Shinkansen, Amtrak's Acela Express and the Talgo.	Exemplos desse equipamento são o Advanced Passenger Train (APT), o Pendolino, o N700 Series Shinkansen, o Amtrak's Acela Express e o Talgo.
Tilting is a dynamic form of superelevation, allowing both low- and high-speed traffic to use the same trackage (though not simultaneously), as well as producing a more comfortable ride for passengers.	Basculante é uma forma dinâmica de superelevação, que permite que o tráfego de baixa e alta velocidade use os mesmos trilhos (embora não simultaneamente), bem como produzir uma viagem mais confortável para os passageiros.
Regional trains usually connect between towns and cities, serving smaller urban (and some rural) communities en route.	Os trens regionais geralmente fazem a conexão entre localidades e cidades, atendendo a pequenas comunidades urbanas (e algumas rurais) no trajeto.
These services are provided to meet local traffic demand in less accessible areas.	Esses serviços são fornecidos para atender à demanda de tráfego local em áreas menos acessíveis.
Higher-speed rail is a special category of trains.	A ferrovia de alta velocidade é uma categoria especial de trens.
The trains for higher-speed rail services can operate at top speeds that are higher than conventional inter-city trains but the speeds are not as high as those in the high-speed rail services.	Os trens para serviços ferroviários de alta velocidade podem operar em velocidades máximas que são mais altas que as dos trens intermunicipais convencionais, mas as velocidades não são tão altas quanto as de serviços ferroviários de alta velocidade.
These services are provided after improvements to the conventional rail infrastructure to support trains that can operate safely at higher speeds.	Esses serviços são fornecidos após aprimoramentos na infraestrutura ferroviária convencional para apoiar trens que podem operar com segurança em velocidades mais altas.
For shorter distances many cities have networks of commuter trains (also known as suburban trains) serving the city and its suburbs.	Para distâncias mais curtas, muitas cidades têm redes de trens comutadores (também conhecidos como trens de subúrbio) que atendem à cidade e seus subúrbios.
Trains are a very efficient mode of transport to cope with large traffic demand in a metropolis.	Os trens são um meio de transporte bastante eficiente para enfrentar a grande demanda de tráfego em uma metrópole.
Compared with road transport, it carries many people with much smaller land area and little air pollution.	Em comparação com o transporte rodoviário, ele transporta muitas pessoas com uma área de terra muito menor e pouca poluição do ar.
Commuter rail also travels longer ranges compared to rapid transit systems with comparatively less frequency and may share tracks with other trains.	Os trens comutadores também percorrem intervalos mais longos em comparação com os sistemas de transporte rápido com frequência comparativamente menor e podem compartilhar trilhos com outros trens.
Some carriages may be laid out to have more standing room than seats, or to facilitate the carrying of prams, cycles or wheelchairs.	Alguns vagões podem ser organizados para ter mais espaço em pé do que assentos, ou para facilitar o transporte de carrinhos, bicicletas ou cadeiras de rodas.
Some countries have double-decked passenger trains for use in conurbations.	Alguns países têm trens de passageiros de dois andares para uso em conurbações.
Double deck high speed and sleeper trains are becoming more common in mainland Europe.	Os trens de alta velocidade de dois andares e os trens noturnos estão se tornando mais comuns na Europa continental.
Sometimes extreme congestion of commuter trains becomes a problem.	Às vezes, o grande congestionamento de trens comutadores se torna um problema.
For example, an estimated 3.5 million passengers ride every day on Yamanote Line in Tokyo, Japan, with its 29 stations.	Por exemplo, calcula-se que 3,5 milhões de passageiros viajam todos os dias na Linha Yamanote em Tóquio, Japão, com suas 29 estações.
For comparison, the New York City Subway carries 5.7 million passengers per day on 28 services serving 472 stations.	Para comparação, o Metrô da Cidade de Nova York transporta 5,7 milhões de passageiros por dia em 28 serviços que atendem 472 estações.
To cope with large traffic, special cars in which the bench seats fold up to provide standing room only during the morning rush hour (until 10 a.m.) are operated in Tokyo (E231 series train).	Para lidar com o grande tráfego, carros especiais nos quais os lugares sentados se dobram para oferecer espaço em pé somente durante a hora do rush matinal (até 10h) são operados em Tóquio (trens série E231).
In the past this train has included 2 cars with six doors on each side to shorten the time for passengers to get on and off at station.	Antigamente, esse trem tinha 2 carros com seis portas de cada lado para diminuir o tempo de embarque e desembarque dos passageiros na estação.
Passenger trains usually have emergency brake handles (or a "communication cord") that the public can operate.	Os trens de passageiros geralmente têm alças de freio de emergência (ou uma "corda de comunicação") que o público pode operar.
Misuse is punished by a heavy fine.	O mau uso é punido com uma multa pesada.
Various commuter and suburban train operators (e.g. Sydney Trains, NJ Transit, Paris RER) use double-decker trains.	Várias operadoras de trens comutadores ou suburbanos (por exemplo Sydney Trains, NJ Transit, Paris RER) usam trens de dois andares.
Double-decker trains offer increased capacity even when running less services.	Os trens de dois andares oferecem maior capacidade até mesmo quando rodam menos serviços.
Large cities often have a rapid transit system, also called "metro", "underground", "subway" or "tube".	Com frequência, cidades grandes têm um sistema de transporte rápido, também chamado de "metrô", "metropolitano", "trem de subsolo" ou "tubo".
The trains are electrically powered, usually by third rail, and their railroads are separate from other traffic, usually without level crossings.	Os trens recebem energia elétrica, geralmente de um terceiro trilho, e suas ferrovias são separadas de outro tráfego, normalmente sem passagens de nível.
Usually they run in tunnels in the city center and sometimes on elevated structures in the outer parts of the city.	Em geral, eles rodam em túneis no centro da cidade e, às vezes, em estruturas elevadas nas partes externas da cidade.
They can accelerate and decelerate faster than heavier, long-distance trains.	Eles podem acelerar e desacelerar mais rápido do que os trens de longa distância mais pesados.
The general term "rapid transit" is used for public transport such as commuter trains, metro and light rail.	O termo genérico "transporte rápido" é usado para o transporte público, por exemplo trens comutadores, metrô e ferrovia leve.
However, services on the New York City Subway have been referred to as "trains", while services on the London Underground are commonly referred to as "tube trains" or "tubes".	No entanto, os serviços no Metrô da Cidade de Nova York tem sido referenciados como "trens", enquanto os serviços no Metrô de Londres são comumente chamados de "trens de tubo" ou "tubos".
In the UK, the distinction between a tramway and a railway is precise and defined in law.	No RU, a distinção entre uma ferrovia elétrica e uma ferrovia é precisa e definida por lei.
In Canada and the US, such street railways are referred to as trolleys or streetcars.	No Canadá e nos EUA, essas ferrovias de rua são denominadas tróleis ou bondes.
The key physical difference between a railroad and a trolley system is that the latter runs primarily on public streets, whereas trains have a right-of-way separated from the public streets.	A principal diferença física entre uma ferrovia e um sistema de trólei é que o último roda basicamente nas vias públicas, enquanto os trens têm uma via separada das vias públicas.
A refrigerator (colloquially fridge) consists of a thermally insulated compartment and a heat pump (mechanical, electronic or chemical) that transfers heat from the inside of the fridge to its external environment so that the inside of the fridge is cooled to a temperature below the room temperature.	Um refrigerador (coloquialmente geladeira) consiste em um compartimento termicamente isolado e uma bomba de aquecimento (mecânica, eletrônica ou química) que transfere o calor de dentro da geladeira para seu ambiente externo, de modo que a parte interna da geladeira seja resfriada para uma temperatura abaixo da temperatura ambiente.
Refrigeration is an essential food storage technique in developed countries.	A refrigeração é uma técnica de armazenamento de alimentos essencial nos países desenvolvidos.
The lower temperature lowers the reproduction rate of bacteria, so the refrigerator reduces the rate of spoilage.	Quanto mais baixa a temperatura, menor a taxa de reprodução de bactérias, para que o refrigerador reduza a taxa de deterioração.
A refrigerator maintains a temperature a few degrees above the freezing point of water.	Uma geladeira mantém uma temperatura alguns graus acima do ponto de congelamento da água.
Optimum temperature range for perishable food storage is 3 to 5 °C (37 to 41 °F).	O intervalo de temperatura ideal para armazenamento de alimentos perecíveis é 3 a 5 °C (37 a 41 °F).
A similar device that maintains a temperature below the freezing point of water is called a freezer.	Um aparelho semelhante que mantém a temperatura abaixo do ponto de congelamento da água é chamado de freezer.
The refrigerator replaced the icebox, which had been a common household appliance for almost a century and a half.	O refrigerador substituiu a caixa de gelo, que foi um aparelho doméstico por quase um século e meio.
The first cooling systems for food involved ice.	Os primeiros sistemas de resfriamento de alimentos envolviam gelo.
Artificial refrigeration began in the mid-1750s, and developed in the early 1800s.	A refrigeração artificial começou em meados dos anos 1750 e se desenvolveu no início dos anos 1800.
In 1834, the first working vapor-compression refrigeration system was built.	Em 1834, o primeiro sistema de refrigeração de compressão de vapor funcional foi construído.
The first commercial ice-making machine was invented in 1854.	A primeira máquina de gelo comercial foi inventada em 1854.
In 1913, refrigerators for home use were invented.	Os refrigeradores para uso residencial foram inventados em 1913.
In 1923 Frigidaire introduced the first self-contained unit.	Em 1923, a Frigidaire lançou a primeira unidade autocontida.
The introduction of Freon in the 1920s expanded the refrigerator market during the 1930s.	O lançamento do freon nos anos 1920 ampliou o mercado de refrigeradores nos anos 1930.
Home freezers as separate compartments (larger than necessary just for ice cubes) were introduced in 1940.	Os freezers domésticos como compartimentos separados (maiores do que o necessário apenas para cubos de gelo) foram lançados em 1940.
Frozen foods, previously a luxury item, became commonplace.	Alimentos congelados, antes um item de luxo, ficaram comuns.
Freezer units are used in households and in industry and commerce.	As unidades de freezer são usadas em residências e na indústria e comércio.
Commercial refrigerator and freezer units were in use for almost 40 years prior to the common home models.	As unidades comerciais de refrigerador e freezer foram usadas por quase 40 anos antes dos modelos domésticos comuns.
The freezer-on-top-and-refrigerator-on-bottom style had been the basic style since the 1940s, until modern refrigerators broke the trend.	O estilo de freezer-em-cima-e-geladeira-em-baixo foi o estilo básico desde os anos 1940, até os refrigeradores modernos mudarem a tendência.
A vapor compression cycle is used in most household refrigerators, refrigerator–freezers and freezers.	Um ciclo de compressão de vapor é usado na maioria dos refrigeradores residenciais, refrigeradores–freezers e freezers.
Newer refrigerators may include automatic defrosting, chilled water, and ice from a dispenser in the door.	Os refrigeradores mais novos podem incluir descongelamento automático, água gelada e gelo de um dispenser na porta.
Domestic refrigerators and freezers for food storage are made in a range of sizes.	Os refrigeradores domésticos e freezers para armazenamento de alimentos são produzidos em vários tamanhos.
Among the smallest are Peltier-type refrigerators designed to chill beverages.	Entre os menores estão os refrigeradores Peltier elaborados para gelar bebidas.
A large domestic refrigerator stands as tall as a person and may be about 1 m wide with a capacity of 600 L.	Um refrigerador doméstico grande é tão alto quanto uma pessoa e pode ter cerca de 1 m de largura com capacidade de 600 L.
Refrigerators and freezers may be free-standing, or built into a kitchen.	Os refrigeradores e freezers podem ser independentes ou integrados em uma cozinha.
The refrigerator allows the modern household to keep food fresh for longer than before.	O refrigerador permite que o domicílio moderno mantenha os alimentos frescos por mais tempo do que antes.
Freezers allow people to buy food in bulk and eat it at leisure, and bulk purchases save money.	Os freezers permitem que as pessoas comprem comida em grandes quantidades e a consumam sem pressa, e compras grandes economizam dinheiro.
Before the invention of the refrigerator, icehouses were used to provide cool storage for most of the year.	Antes da invenção do refrigerador, casas de gelo eram usadas para fornecer armazenamento frio durante a maior parte do ano.
Placed near freshwater lakes or packed with snow and ice during the winter, they were once very common.	Colocadas perto de lagos de água doce ou cheias de neve e gelo no inverno, elas já foram muito comuns.
Natural means are still used to cool foods today.	Os meios naturais ainda são usados para resfriar alimentos hoje em dia.
On mountainsides, runoff from melting snow is a convenient way to cool drinks, and during the winter one can keep milk fresh much longer just by keeping it outdoors.	Nas montanhas, o escoamento da neve derretida é um jeito prático de resfriar bebidas e, durante o inverno, é possível conservar o leite fresco por muito mais tempo apenas colocando-o do lado de fora.
