The original part of the album blends into the first of the four additional tracks, and each of the additional tracks also blend into each other.	A parte original do álbum se mistura com a primeira das quatro faixas adicionais, e cada uma das faixas adicionais também se mistura com as outras.
This gives the album a sense of continuation from start to finish.	Isso dá ao álbum uma noção de continuação do início ao fim.
One of the remixes, The Returning Silence of The Rivers of Belief, does not appear on any of the singles.	Um deles, The Returning Silence of The Rivers of Belief, não aparece em nenhum dos singles.
The November 1999 reissue includes six remixed tracks on a second disc.	A nova edição de novembro de 1999 contém seis faixas remixadas em um segundo disco.
In March 2016 a numbered Limited Edition was released on Hybrid SACD in Hong Kong.	Em março de 2016, uma Edição Limitada numerada foi lançada em SACD Híbrido em Hong Kong.
Janet B. Blundell, in Library Journal, finds Angelou's poetry lacking in comparison to her prose, and states, "The reader is jarred by stilted, 'poetic' language and stilted, sing-song, school-girlish rhyme".	Janet B. Blundell, em Library Journal, considera a poesia de Angelou inferior à prosa dela e afirma, "O leitor é perturbado por uma linguagem "poética" artificial e por uma rima infantil, cantarolante e artificial".
She finds the best poems in Shaker are the ones that are structured like blues music.	Ela considera que os melhores poemas em Shaker são aqueles estruturados como blues.
Mary S. Cosgrove, in Horn Book Magazine, calls the poems in Shaker "a lyrical outpouring of seasoned feelings from the heart and mind", and calls Angelou "musical, rhythmical, and enchanting".  J.T.	Mary S. Cosgrove, em Horn Book Magazine, chama os poemas em Shaker de "uma efusão lírica de sentimentos maduros, do coração e da mente" e chama Angelou de "musical, rítmica e encantadora".  J.T.
Keefe, in World Literature Today, says about Shaker": "Deceptively light and graceful, Maya Angelou's poems are lyrical, emotional, melancholy".	Keefe, em World Literature Today, fala sobre Shaker": "Dissimuladamente leves e graciosos, os poemas de Maya Angelou são líricos, emocionais, melancólicos".
Keefe compares Angelou's poems to music, especially the music of French singer Édith Piaf, and also states, "These poems are full of shining hurt as, like curving scimitars, they skillfully pierce the hearts of their readers".	Keefe compara os poemas de Angelou à música, principalmente à música da cantora francesa Édith Piaf, e também afirma, "Esses poemas estão repletos de uma dor reluzente, pois, como cimitarras, perfuram com habilidade os corações de seus leitores".
In a commentary made for the 1980 anthology, The Golden Man, Philip K. Dick briefly touched on several themes of the story, including the Christian allegory of the "suffering servant", manifested in the character of Bors.	Em um comentário feito para a antologia de 1980, The Golden Man, Philip K. Dick tocou brevemente em vários temas da história, incluindo a parábola Cristã do "cântico do servo", manifestado no personagem de Bors.
This was touched upon in the Dick biography Divine Invasions, by memoirist and biographer Lawrence Sutin.	Esse tema foi abordado na biografia de Dick, Divine Invasions, do memorialista e biógrafo Lawrence Sutin.
Drawing on Dick's commentary, Sutin sees Bors as part of a religious pattern in Dick's stories as a "Christ-like robot", and likens the robot to characters in other stories by Dick who suffer from illness.	Inspirando-se no comentário do Dick, Sutin vê Bors como parte de um padrão religioso nas histórias do Dick, como um "robô do tipo Cristão", e compara o robô a personagens de outras histórias do Dick que sofrem de doença.
At age 11, Madden joined PACE Youth Theatre to help overcome his shyness.	Aos 11 anos, Madden ingressou no PACE Youth Theatre para ajudar a superar a sua timidez.
He was soon cast as young Andy in the film adaptation of Iain Banks's Complicity; he was then cast in the lead role of Sebastian in the children's television series Barmy Aunt Boomerang, for which he filmed six episodes that aired from 1999 until 2000.	Ele foi logo convocado para o papel do jovem Andy na adaptação para o cinema de Cumplicidade, de Iain Banks; depois ele foi chamado para representar o papel principal de Sebastian na série infantil de televisão Barmy Aunt Boomerang, para a qual gravou seis episódios que foram ao ar de 1999 a 2000.
He attended the Royal Scottish Academy of Music and Drama (RSAMD) in Glasgow, from where he graduated in 2007. While at RSAMD, he worked with The Arches and Glasgow Repertory Company, followed by Franz Xaver Kroetz's play Tom Fool at the Citizens' Theatre, which was so well received that it transferred to London, where Madden was spotted by a team from Shakespeare's Globe.	Ele frequentou a Royal Scottish Academy of Music and Drama (RSAMD) em Glasgow, onde se formou em 2007. Enquanto estava na RSAMD, trabalhou com a The Arches e a Glasgow Repertory Company, depois atuou na peça de Franz Xaver Kroetz, Tom Fool, no Citizens Theatre, uma obra tão bem recebida que acabou sendo transferida para Londres, onde Madden foi notado por uma equipe do Shakespeare's Globe.
In his final year with RSAMD, he was cast as Romeo in a production of Romeo and Juliet at the modern Globe Theatre which, after an initial run in London, made a tour of open-air stages during the summer of 2007, this being the Globe's first tour.	Em seu último ano na RSAMD, ele contracenou como Romeu em uma produção de Romeu e Julieta no moderno teatro Globe que, após uma temporada inicial em Londres, fez uma turnê ao ar livre durante o verão de 2007, sendo essa turnê a primeira do Globe.
He played Callum McGregor in the stage production of Malorie Blackman's Noughts & Crosses in 2008.	Ele interpretou Callum McGregor na produção teatral Noughts & Crosses de Malorie Blackman em 2008.
He later gained the lead role of Dean McKenzie in the 2009 BBC comedy-drama series Hope Springs, followed by his roles as Ripley in the 2010 film Chatroom, and as Theatre of Hate singer Kirk Brandon in the 2010 film Worried About The Boy.	Mais tarde, ele conquistou o papel principal de Dean McKenzie na série cômico-dramática Hope Springs da BBC de 2009, seguido por seus papéis como Ripley no filme A Sala Negra de 2010 e como o cantor Kirk Brandon do Theatre Of Hate no filme A Vida É Meu Palco de 2010.
From 2011 to 2013, he starred as Robb Stark in the HBO series Game of Thrones, based upon the series of novels, A Song of Ice and Fire, by George R. R. Martin.	De 2011 a 2013, ele estrelou como Robb Stark na série A Guerra dos Tronos da HBO, baseada na série de romances As Crônicas de Gelo e Fogo, de George R. R. Martin.
Speaking in September 2018, Madden claimed that he was not paid much for his role in Game of Thrones.	Falando nisso, em setembro de 2018 Madden afirmou que não recebeu muito pelo seu papel em A Guerra dos Tronos.
During this period, Madden also starred in the Channel 4 comedy-drama series Sirens,and in the BBC drama series Birdsong.	Durante esse período, Madden também estrelou a série cômico-dramática Sirens do Channel 4, além da série dramática O Canto do Pássaro da BBC.
In May 2013, Madden was chosen to portray the prince in the live action Disney film Cinderella.	Em maio de 2013, Madden foi escolhido para interpretar o príncipe no filme live-action da Disney Cinderela.
The film was released in March 2015.	O filme foi lançado em março de 2015.
Madden first obtained his Screen Actors Guild (SAG) card for the 2014 miniseries Klondike, in which he plays Bill Haskell.	Madden obteve pela primeira vez seu cartão de Screen Actors Guild (SAG) para a minissérie Klondike de 2014, na qual ele interpreta Bill Haskell.
Between 12 May and 13 August 2016, Madden appeared on stage in London's West End playing the part of Romeo in Romeo and Juliet, where he was reunited with his Cinderella costar Lily James, who played Juliet, and director Kenneth Branagh.	Entre 12 de maio e 13 de agosto de 2016, Madden apareceu no palco do West End de Londres interpretando o papel de Romeu, em Romeu e Julieta, no qual se reuniu com a sua co-estrela de Cinderela Lyli James, que fez Julieta, e o diretor Kenneth Branagh.
Richard was replaced as Romeo in July 2016, after suffering an ankle injury.	Richard foi substituído como Romeu em julho de 2016, após sofrer uma lesão no tornozelo.
In 2016, he played the leading role of Cosimo de' Medici, the son of the founder of the Medici Bank during the Italian Renaissance, in the Italian-British television drama series, Medici: Masters of Florence.	Em 2016, desempenhou o papel principal de Cosme de Médici, filho do fundador do Banco Médici durante o Renascimento italiano, na série televisiva dramática ítalo-britânica Os Médici: Senhores de Florença.
In the same year he played American pickpocket Michael Mason in the 2016 action movie Bastille Day, starring alongside Idris Elba.	No mesmo ano, ele interpretou o batedor de carteiras americano Michael Mason no filme de ação Atentado Em Paris, de 2016, estrelando ao lado de Idris Elba.
In 2018, Madden garnered widespread critical acclaim and wider recognition for his role as Sergeant David Budd in the BBC thriller series Bodyguard.	Em 2018, Madden recebeu ampla aclamação da crítica e grande reconhecimento pelo seu papel como o sargento David Budd na série de suspense da BBC Bodyguard.
After achieving high levels of popularity in the UK, the show was released to a worldwide audience on Netflix in October 2018.	Após atingir altos níveis de popularidade no Reino Unido, o show foi lançado para o público mundial na Nextflix em outubro de 2018.
His performance earned him a Golden Globe Award for Best Actor – Television Series Drama.	Seu desempenho rendeu-lhe um Globo de Ouro de Melhor Ator em série dramática para a televisão.
Bodyguard went on to be nominated for the Primetime Emmy Award for Outstanding Drama Series.	A série Bodyguard foi nomeada aos Prêmios Emmy do Primetime como Melhor Série de Drama.
Jolie first witnessed the effects of a humanitarian crisis while filming Lara Croft: Tomb Raider (2001) in war-torn Cambodia, an experience she later credited with having brought her a greater understanding of the world.	Jolie testemunhou pela primeira vez os efeitos de uma crise humanitária durante as filmagens de Lara Croft: Tomb Raider (2001) no Camboja, após ser devastado pela guerra, uma experiência que ela mais tarde creditou por trazer-lhe mais compreensão sobre o mundo.
Upon her return home, Jolie contacted the United Nations High Commissioner for Refugees (UNHCR) for information on international trouble spots.	Ao voltar para casa, Jolie contatou o Alto-Comissariado das Nações Unidas para os Refugiados (ACNUR) para obter informações sobre os pontos de conflito internacionais.
To learn more about the conditions in these areas, she began visiting refugee camps around the world.	Para conhecer as condições nessas áreas, ela começou a visitar campos de refugiados no mundo todo.
In February 2001, she went on her first field visit, an 18-day mission to Sierra Leone and Tanzania; she later expressed her shock at what she had witnessed.	Em fevereiro de 2001, ela fez a sua primeira visita de campo, uma missão de 18 dias entre Serra Leoa e a Tanzânia; mais tarde, ela expressou seu choque sobre aquilo que testemunhou.
In the following months, Jolie returned to Cambodia for two weeks and met with Afghan refugees in Pakistan, where she donated $1 million in response to an international UNHCR emergency appeal, the largest donation UNHCR had ever received from a private individual.	Nos meses seguintes, Jolie voltou ao Camboja por duas semanas e se encontrou com refugiados afegãos no Paquistão, onde doou um milhão de dólares em resposta a um apelo internacional de emergência do ACNUR, a maior doação que o ACNUR já recebeu proveniente de uma pessoa física.
She covered all costs related to her missions and shared the same rudimentary working and living conditions as UNHCR field staff on all of her visits.	Ela cobriu todos os custos relacionados às suas missões e compartilhou as mesmas condições rudimentares de trabalho e de vida com a equipe de campo do ACNUR em todas as suas visitas.
Jolie was named a UNHCR Goodwill Ambassador at UNHCR headquarters in Geneva on August 27, 2001.	Jolie foi nomeada Embaixadora da Boa Vontade do ACNUR na sede da instituição em Genebra em 27 de agosto de 2001.
Over the next decade, she went on more than 40 field missions, meeting with refugees and internally displaced persons in over 30 countries.	Na década seguinte, ela participou de 40 missões de campo, encontrando-se com refugiados e pessoas deslocadas internamente em mais de 30 países.
In 2002, when asked what she hoped to accomplish, she stated, "Awareness of the plight of these people.	Em 2002, quando questionada sobre o que esperava alcançar, ela afirmou: “Conscientizar sobre a situação dessas pessoas.
I think they should be commended for what they have survived, not looked down upon." To that end, her 2001–02 field visits were chronicled in her book Notes from My Travels, which was published in October 2003 in conjunction with the release of her humanitarian drama Beyond Borders.	Acredito que elas deveriam ser condecoradas pelo que sobreviveram e não menosprezadas.” Para esta finalidade, suas visitas de campo entre 2001 e 2002 foram narradas em seu livro Diário das Minhas Viagens, publicado em outubro de 2003 em paralelo com o lançamento de seu drama humanitário Amor Sem Fronteiras.
Jolie aimed to visit what she termed "forgotten emergencies," crises that media attention had shifted away from.	Jolie pretendia visitar o que chamou “emergências esquecidas”, crises das quais a atenção da mídia havia se desviado.
She became noted for traveling to war zones, such as Sudan's Darfur region during the Darfur conflict, the Syrian-Iraqi border during the Second Gulf War, where she met privately with U.S. troops and other multi-national forces, and the Afghan capital Kabul during the war in Afghanistan, where three aid workers were murdered in the midst of her first visit.	Ela se tornou conhecida por viajar para zonas de guerra, como a região de Darfur no Sudão durante o conflito de Darfur; a fronteira entre a Síria e o Iraque durante a Segunda Gerra do Golfo, onde se encontrou em particular com tropas dos EUA e outras forças multinacionais; e a capital afegã Cabul durante a guerra no Afeganistão, em que três trabalhadores humanitários foram assassinados no meio da sua primeira visita.
To aid her travels, she began taking flying lessons in 2004 with the aim of ferrying aid workers and food supplies around the world; she now holds a private pilot license with instrument rating and owns a Cirrus SR22 and Cessna 208 Caravan single-engine aircraft.	Para ajudar em suas viagens, ela começou a ter aulas de voo em 2004 com o objetivo de transportar trabalhadores humanitários e suprimentos alimentares ao redor do mundo; agora ela possui uma licença de piloto particular com qualificação de instrumentos e duas aeronaves monomotor, uma Cirrus SR22 e uma Cessna 208 Caravan.
On April 17, 2012, after more than a decade of service as a UNHCR Goodwill Ambassador, Jolie was promoted to the rank of Special Envoy to High Commissioner António Guterres, the first to take on such a position within the organization.	No dia 17 de abril de 2012, após mais de uma década de serviço como Embaixadora da Boa Vontade do ACNUR, Jolie foi promovida ao cargo de Enviada Especial do Alto-Comissário António Guterres, a primeira a assumir tal função na organização.
In her expanded role, she was given authority to represent Guterres and UNHCR at the diplomatic level, with a focus on major refugee crises.	Em sua função ampliada, ela recebeu autoridade para representar Guterres e o ACNUR ao nível diplomático, com foco nas principais crises de refugiados.
In the months following her promotion, she made her first visit as Special Envoy—her third over all—to Ecuador, where she met with Colombian refugees, and she accompanied Guterres on a week-long tour of Jordan, Lebanon, Turkey, and Iraq, to assess the situation of refugees from neighboring Syria.	Nos meses seguintes à sua promoção, ela fez sua primeira visita como enviada especial, sua terceira no total, ao Equador, onde se encontrou com refugiados colombianos, e acompanhou Guterres em uma viagem de uma semana pela Jordânia, Líbano, Turquia e Iraque, para avaliar a situação dos refugiados do país vizinho, a Síria.
Since then, Jolie has gone on over a dozen field missions around the world to meet with refugees and undertake advocacy on their behalf.	Desde então, Jolie fez mais de uma dúzia de missões de campo ao redor do mundo para se encontrar com refugiados e realizar ações de ativismo em seu nome.
In an effort to connect her Cambodian-born adopted son with his heritage, Jolie purchased a house in his country of birth in 2003.	Em um esforço para conectar seu filho adotivo nascido no Camboja ao seu legado histórico, Jolie comprou uma casa no país de nascimento dele em 2003.
The traditional home sat on 39 hectares in the northwestern province Battambang, adjacent to Samlout national park in the Cardamom mountains, which had become infiltrated with poachers who threatened endangered species.	A casa tradicional ocupava 39 hectares na província noroeste de Battambang, adjacente ao parque nacional Samlout, nas montanhas Cardamomo, que tinham sido invadidas por caçadores ilegais que ameaçavam as espécies em extinção.
She purchased the park's 60,000 hectares and turned the area into a wildlife reserve named for her son, the Maddox Jolie Project.	Ela comprou 60.000 hectares do parque e transformou a área em uma reserva de vida selvagem com o nome de seu filho, o Projeto Maddox Jolie.
Released as a single in July 1969, "Space Oddity" was a largely acoustic number augmented by the eerie tones of the composer's Stylophone, a pocket electronic organ.	Lançado como single em julho de 1969, “Space Oddity” foi um número amplamente acústico aumentado pelos tons arrepiantes do estilofone do compositor, um órgão eletrônico de bolso.
The title and subject matter were inspired by Stanley Kubrick's 2001: A Space Odyssey and introduced the character of Major Tom.	O título e o assunto foram inspirados no filme de Stanley Kubrick 2001: Uma Odisseia no Espaço e apresentaram o personagem Major Tom.
The song dates back as early as February 1969.	A música é de fevereiro de 1969.
It was written for a promotional video named "Love You till Tuesday".	Ela foi escrita para um vídeo promocional chamado “Love You till Tuesday”.
The video's intent was to sell Bowie to a new label as he had been dropped from Deram Records in April 1968.	A intenção do vídeo era vender Bowie para uma nova gravadora, já que ele havia saído da Deram Records em abril de 1968.
He was urged by his manager Kenneth Pitt to record some new material and so "Space Oddity" was born.	Ele foi incentivado pelo seu empresário Kenneth Pitt a gravar um novo material e foi assim que “Space Oddity” nasceu.
Some commentators have also seen the song as a metaphor for heroin use, citing the opening countdown as analogous to the drug's passage down the needle prior to the euphoric 'hit', and noting Bowie's admission of a "silly flirtation with smack" in 1968.	Alguns comentaristas também viram a música como uma metáfora para o uso de heroína, citando a contagem regressiva de abertura como análoga à passagem da droga pela agulha antes do pico de euforia, e observando a declaração de Bowie sobre ter um “flerte inocente com uma onda” feita em 1968.
His 1980 hit "Ashes to Ashes" declared "We know Major Tom's a junkie".	Em seu sucesso de 1980, “Ashes to Ashes”, ele declarou “Nós sabemos que o Major Tom é um viciado”.
"Unwashed and Somewhat Slightly Dazed" reflected a strong Bob Dylan influence, with its harmonica, edgy guitar sound and snarling vocal.	A música “Unwashed and Somewhat Slightly Dazed” refletiu uma forte influência de Bob Dylan, com sua gaita, seu som de guitarra ousado e seu vocal estridente.
"Letter to Hermione" was a farewell ballad to Bowie's former girlfriend, Hermione Farthingale, who was also the subject of "An Occasional Dream", a gentle folk tune reminiscent of the singer's 1967 debut album.	“Letter to Hermione” foi uma balada de despedida para a ex-namorada de Bowie, Hermione Farthingale, que também foi tema de “An Occasional Dream”, uma suave melodia folk que lembra o álbum de estreia do cantor em 1967.
"God Knows I'm Good", Bowie's observational tale of a shoplifter's plight, also recalled his earlier style.	“God Knows I'm Good”, a história de Bowie como observador da situação de um ladrão, também lembrava seu estilo de vida prévio.
"Cygnet Committee" has been called Bowie's "first true masterpiece".	“Cygnet Committee” foi considerada sua “primeira obra-prima de verdade”.
Commonly regarded as the album track most indicative of the composer's future direction, its lead character is a messianic figure "who breaks down barriers for his younger followers, but finds that he has only provided them with the means to reject and destroy him".	Foi comumente considerada como a faixa do álbum mais indicativa sobre a direção futura do cantor, seu personagem principal é uma figura messiânica “que quebra as barreiras de seus seguidores mais jovens, mas descobre que só lhes forneceu os meios para rejeitá-lo e destruí-lo”.
Bowie himself described it at the time as a put down of hippies who seemed ready to follow any charismatic leader.	O próprio Bowie descreveu na época como uma humilhação dos hippies, que pareciam dispostos a seguir qualquer líder carismático.
Another track cited as foreshadowing themes to which Bowie would return in the 1970s, in this case the fracturing of personality, was "Janine", which featured the words "But if you took an axe to me, you'd kill another man not me at all".	Outra faixa citada como previsão sobre temas que Bowie voltaria a abordar nos anos 1970, no caso, a quebra de personalidade, foi “Janine”, que divulgou a frase “mas se você me desse uma machadada, mataria outro homem e não eu”.
The Buddhism-influenced "Wild Eyed Boy from Freecloud" was presented in a heavily expanded form compared to the original guitar-and-cello version on the B-side of the "Space Oddity" single; the album cut featured a 50-piece orchestra.	A canção “Wild Eyed Boy from Freecloud”, influenciada pelo budismo, foi apresentada em uma forma poderosamente expandida em comparação com a versão original, com guitarra e violoncelo, no lado B do single “Space Oddity”; a faixa do álbum contou com uma orquestra de 50 integrantes.
"Memory of a Free Festival" was Bowie's reminiscence of an arts festival he had organised in August 1969.	“Memory of a Free Festival” representou a reminiscência de Bowie sobre um festival de artes que ele organizou em agosto de 1969.
Its drawn-out fade/chorus ("The Sun Machine is coming down / And we're gonna have a party") was compared to The Beatles' "Hey Jude"; the song has also been interpreted as a derisive comment on the counterculture it was ostensibly celebrating.	Seu refrão prolongado (“The Sun Machine is coming down/And we're gonna have a party”) foi comparado a “Hey Jude” dos Beatles; a canção também foi interpretada como um comentário sarcástico sobre a contracultura que estava ostensivamente celebrando.
The background vocals for the crowd finale featured Bob Harris, his wife Sue, Tony Woollcott and Marc Bolan among other people.	Os vocais de fundo para o final com a multidão figuraram Bob Harris, sua esposa Sue, Tony Woollcott e Marc Bolan, entre outras pessoas.
In 1970 Bowie cut the tune in half for the A- and B-sides of a more rock-oriented version featuring the band that would accompany him on The Man Who Sold the World later that year: Mick Ronson, Tony Visconti and Mick Woodmansey – an embryonic form of Ziggy Stardust's Spiders From Mars.	Em 1970, Bowie cortou a melodia pela metade para os lados A e B de uma versão mais voltada para o rock, apresentando a banda que o acompanharia em The Man Who Sold the World mais tarde naquele ano: Mick Ronson, Tony Visconti e Mick Woodmansey, uma forma embrionária de Spiders From Mars de Ziggy Stardust.
NY 215 began at a three-way intersection with NY 360 east of the hamlet of Morton in the town of Hamlin.	A NY 215 teve início em uma interseção de três vias com a NY 360 a leste do vilarejo de Morton, na cidade de Hamlin.
NY 360 turned off Redman Road here to follow Morton Road west to the hamlet of Morton while NY 215 headed north on Redman Road.	A NY 360 saia da estrada Redman aqui para seguir a estrada Morton a oeste até o vilarejo de Morton, enquanto a NY 215 dirigia-se a norte na Redman.
It passed by open, cultivated fields and small pockets of residences as it proceeded through rural northwestern Monroe County.	Ela passava por campos abertos e cultivados e pequenos grupos residenciais à medida que avançava pela zona rural do noroeste do condado de Monroe.
After 1.5 miles (2.4 km), NY 215 intersected Moscow Road, a local highway connecting NY 215 to the then-western end of the Lake Ontario State Parkway.	Após 1,5 milhas (2,4 km), a NY 215 cruzava a estrada Moscow, uma rodovia local que conectava a NY 215 à extremidade oeste da autoestrada Lake Ontario State Parkway.
