There were varying degrees of Romanization throughout Roman Dacia.	Houve vários graus de romanização em toda a Dácia romana.
The most Romanized segment was the region along the Danube, which was predominately under imperial administration, albeit in a form that was partially barbarized.	O segmento mais romanizado foi a região ao longo do Danúbio, que esteve predominantemente sob administração imperial, embora de uma forma parcialmente bárbara.
The population beyond this zone, having lived with the Roman legions before their withdrawal, were substantially Romanized.	A população além dessa zona, tendo vivido com as legiões romanas antes de sua retirada, foi substancialmente romanizada.
The final zone, consisting of the northern portions of Maramures, Crisana, and Moldavia, stood at the edges of Roman Dacia.	A zona final, que consiste nas porções norte de Maramures, Crisana e Moldávia, situava-se nos limites da Dácia romana.
Although its people did not have Roman legions stationed among them, they were still nominally under the control of Rome, politically, socially, and economically.	Embora seus povos não tivessem legiões romanas posicionadas entre eles, ainda seguiram nominalmente sob o controle de Roma, política, social e economicamente.
These were the areas in which resided the Carpi, often referred to as the Free Dacians.	Essas foram as áreas em que viviam os carpos, frequentemente chamados dácios livres.
In an attempt to fill the cities, cultivate the fields, and mine the ore, a large-scale attempt at colonization took place with colonists coming in "from all over the Roman world".	Com o intuito de preencher as cidades, cultivar os campos e extrair o minério, uma tentativa de colonização em grande escala ocorreu com colonizadores vindos “de todo o mundo romano”.
The colonists were a heterogeneous mix: of the some 3,000 names preserved in inscriptions found by the 1990s, 74% (c. 2,200) were Latin, 14% (c. 420) were Greek, 4% (c. 120) were Illyrian, 2.3% (c. 70) were Celtic, 2% (c. 60) were Thraco-Dacian, and another 2% (c. 60) were Semites from Syria.	Os colonizadores formavam uma mistura heterogênea: dos quase  3.000 nomes preservados em inscrições encontradas na década de 1990, 74% (c. 2.200) eram latinos, 14% (c. 420) eram gregos, 4% (c. 120) eram ilírios, 2,3% (c. 70) eram celtas, 2% (c. 60) eram daco-trácios, e outros 2% (c. 60) eram semitas da Síria.
Regardless of their place of origin, the settlers and colonists were a physical manifestation of Roman civilisation and imperial culture, bringing with them the most effective Romanizing mechanism: the use of Latin as the new lingua franca.	Independentemente dos seus locais de origem, os colonizadores foram uma manifestação física da civilização romana e da cultura imperial, trazendo consigo o mecanismo de romanização mais eficaz: o uso do latim como nova língua-franca.
The first settlement at Sarmizegethusa was made up of Roman citizens who had retired from the legions.	O primeiro povoado em Samirzegetusa era formado por cidadãos romanos que haviam se aposentado das legiões.
Based upon the location of names scattered throughout the province, it has been argued that, although places of origin are hardly ever noted in epigraphs, a large percentage of colonists originated from Noricum and western Pannonia.	Com base na localização de nomes espalhados por toda a província, argumentou-se que, embora os locais de origem sejam raramente mencionados nas epígrafes, uma grande porcentagem dos colonizadores era original da Nórica e da Polônia ocidental.
Specialist miners (the Pirusti tribesmen) were brought in from Dalmatia.	Mineiros especializados (membros da tribo Pirusti) foram trazidos da Dalmácia.
These Dalmatian miners were kept in sheltered communities (Vicus Pirustarum) and were under the jurisdiction of their own tribal leadership (with individual leaders referred to as princeps).	Esses mineiros dálmatas foram mantidos em comunidades protegidas (Vicus Pirustarum) e ficavam sob a jurisdição da sua própria liderança tribal (com líderes individuais referidos como príncipes).
An estimated 50,000 troops were stationed in Dacia at its height.	Um número estimado de 50.000 soldados ficava posicionado na Dácia em seu auge.
At the close of Trajan's first campaign in Dacia in 102, he stationed one legion at Sarmizegetusa Regia.	No final da primeira iniciativa de Trajano na Dácia em 102, ele posicionou uma legião em Sarmizegetusa Regia.
With the conclusion of Trajan's conquest of Dacia, he stationed at least two legions in the new province – the Legio IV Flavia Felix positioned at Berzobis, and the Legio XIII Gemina stationed at Apulum.	Com a conclusão da conquista da Dácia por Trajano, ele posicionou pelo menos duas legiões na nova província: a Legio IV Flavia Felix em Berzobis; e a Legio XIII Gemina em Apulum.
It has been conjectured that there was a third legion stationed in Dacia at the same time, the Legio I Adiutrix.	Supôs-se que havia uma terceira legião posicionada na Dácia em simultâneo, a Legio I Adiutrix.
However, there is no evidence to indicate when or where it was stationed, and it is unclear whether the legion was fully present, or whether it was only the vexillationes who were stationed in the province.	No entanto, não há evidências que indiquem quando ou onde foi posicionada, e não está claro se a legião estava totalmente presente ou se eram apenas vexilações que estavam posicionadas na província.
Hadrian, the subsequent emperor, shifted the fourth legion (Legio IV Flavia Felix) from Berzobis to Singidunum in Moesia Superior, suggesting that Hadrian believed the presence of one legion in Dacia would be sufficient to ensure the security of the province.	Adriano, o imperador seguinte, transferiu a quarta legião (Legio IV Flavia Felix) de Berzobis para Singidunum na Mésia Superior, sugerindo que Adriano acreditava que a presença de uma legião na Dácia seria suficiente para garantir a segurança da província.
The Marcomannic Wars that erupted north of the Danube forced Marcus Aurelius to reverse this policy, permanently transferring the Legio V Macedonica from Troesmis (modern Iglița in Romania) in Moesia Inferior to Potaissa in Dacia.	As Guerras Marcomanas que eclodiram ao norte do Danúbio forçaram Marco Aurélio a reverter essa política, transferindo permanentemente a Legio V Macedonica de Troesmis (moderna Iglita na Romênia), na Mésia Inferior, para Potaissa, na Dácia.
The Kingston Fossil Plant is located on a peninsula at the junction of the Emory River (to the north) and Clinch River (to the south and east), just over 4 miles (6.4 km) upstream from the latter's mouth along the Tennessee River.	A usina de combustíveis fósseis de Kingston está localizada em uma península na junção dos rios Emory (ao norte) e Clinch (ao sul e ao leste), pouco mais de 4 milhas (6,4 km) a montante da foz desse último ao longo do rio Tennessee.
Watts Bar Dam, located along the Tennessee 38 miles (61 km) downstream from the mouth of the Clinch, impounds a reservoir (Watts Bar Lake) that spans a 72-mile (116 km) stretch of the Tennessee (to Fort Loudoun Dam), the lower 23 miles (37 km) of the Clinch (to Melton Hill Dam), and the lower 12 miles (19 km) of the Emory.	A represa Watts Bar, localizada ao longo das 38 milhas (61 km) do Tennessee a jusante da foz do Clinch, contém um reservatório (Watts Bar Lake) que se estende por um trecho de 72 milhas (116 km) do Tennessee (para a represa Fort Loudoun), a parte inferior de 23 milhas (37 km) do Clinch (para a represa Melton Hill) e a parte inferior de 12 milhas (19 km) do Emory.
The plant, originally known as the Kingston Steam Plant, began operations in 1954, primarily to provide electricity to atomic energy installations at nearby Oak Ridge.	A usina, originalmente conhecida como Kingston Steam Plant, iniciou suas operações em 1954, principalmente para fornecer eletricidade a instalações de energia atômica nas proximidades de Oak Ridge.
The plant contains nine units with a combined generating capacity of 1,398 megawatts, and burns about 14,000 tonnes (14,000,000 kg) of coal every day.	A usina contém nove unidades com uma capacidade de geração combinada de 1.398 megawatts e queima cerca de 14.000 toneladas (14.000.000 kg) de carvão diariamente.
The plant's ash pond disposal area is located immediately north of the plant along the Emory River shore.	A área de descarte do tanque de cinzas da usina se localiza imediatamente ao norte da fábrica ao longo da costa do rio Emory.
The ash pond, which was impounded by a dike that rose 60 feet (18 m) above the winter level and 741 feet (226 m) above sea level, contained a watery slurry of fly ash generated by the burning of finely ground coal at the power plant.	O tanque de cinzas, apreendido por um dique que subiu 60 pés (18 metros) acima do nível do inverno e 741 pés (226 metros) acima do nível do mar, continha uma pasta aquosa de cinzas volantes gerada pela queima de carvão finamente moído na usina elétrica.
Fly ash is the fine particulate pollutants produced by the combustion of coal, which are collected rather than allowing them to escape into the atmosphere, then mixed with water and pumped into a retaining pond, where the ash gradually settles to the bottom.	As cinzas volantes são partículas poluentes produzidas pela combustão do carvão, coletadas para evitar seu escape para atmosfera, misturadas com água e bombeadas para o tanque de retenção, onde elas gradualmente se depositam no fundo.
Once the particulate matter settles out, it is dredged and moved to drying cells.	Assim que o material das partículas se assenta, ele é dragado e movido para células de secagem.
The 84-acre (0.34 km²) unlined above-ground dredge cell was surrounded by 60-foot (18 m) tall earthen dikes.	As células de dragagem aéreas não revestidas que se estendem ao longo de 84 acres (0,34 km²) foram cercadas por diques de terra de 60 pés (18 metros) de altura.
The dike breach occurred at the northwest corner of the dewatering pond, overlooking the Swan Pond Creek spillway.	O vazamento do dique ocorreu no canto noroeste do tanque de drenagem, ignorando o vertedouro de Swan Pond Creek.
TVA had reportedly known about the dangers of using wet storage ponds for coal ash since a 1969 spill in Virginia in which coal ash seeped into the Clinch River and killed countless fish.	A TVA alegadamente sabia dos perigos do uso de tanques de armazenamento molhados para cinzas de carvão desde um vazamento em 1969 na Virgínia, no qual as cinzas de carvão penetraram o rio Clinch e mataram inúmeros peixes.
In the 1980s, TVA engineers raised concerns about the stability of ash ponds.	No anos 1980, os engenheiros da TVA levantaram questões sobre a estabilidade dos tanques de cinzas.
The utility repeatedly found leaks in levees and seepage in the soil at many of their ash ponds, including the ones at Kingston.	A unidade encontrou repetidamente vazamentos em diques e infiltrações no solo em muitos de seus tanques de cinzas, incluindo os de Kingston.
However, TVA continued to make small repairs instead of switch to dry storage systems which would have cost ratepayers tens of millions.	No entanto, a TVA continuou realizando pequenos reparos em vez de mudar para sistemas de armazenamento a seco, o que teria custado dezenas de milhões aos contribuintes.
At the time of the disaster, TVA was using wet storage at six of their 11 coal-fired power plants.	No momento do desastre, a TVA estava usando armazenamento molhado em seis de suas 11 usinas termelétricas a carvão.
Leaks at the Kingston ash ponds had reportedly been taking place since the early 1980s, and local residents said that the spill was not a unique occurrence.	Vazamentos nos tanques de cinzas de Kingston estariam ocorrendo desde o início dos anos 1980, e os residentes locais disseram que o derramamento não foi uma ocorrência única.
The 1960s-era pond had been observed leaking and being repaired nearly every year since 2001.	O tanque da década de 1960 foi encontrado vazando e reparado quase todos os anos desde 2001.
The two worst leaks occurred in 2003 and 2006 in which TVA suspended all ash deposits in the ponds to allow the dredge cells to dry out and stabilize.	Os dois piores vazamentos ocorreram em 2003 e em 2006, nos quais a TVA suspendeu todos os depósitos de cinzas nos tanques para permitir que as células de drenagem secassem e se estabilizassem.
An October 2008 inspection report had identified a "minor leak" in the faulty wall, but the report was not finalized.	Um relatório de inspeção de outubro de 2008 identificou um “pequeno vazamento” na parede com defeito, mas o relatório não foi finalizado.
The spill began sometime between midnight and 1 a.m.	O derramamento começou entre a meia-noite e a 1 hora da manhã.
In January 1973 Young was made Chief of the Space Shuttle Branch of the Astronaut Office.	Em janeiro de 1973, Young foi nomeado chefe da filial do escritório dos astronautas ligados ao ônibus espacial.
In January 1974, he became Chief of the Astronaut Office after the retirement of Alan Shepard.	Em janeiro de 1974, ele se tornou chefe do escritório dos astronautas após Alan Shepard se aposentar.
Young flew two missions of the Space Shuttle, both aboard the Space Shuttle Columbia.	Young voou em duas missões com o ônibus espacial, ambas a bordo do ônibus espacial Columbia.
He commanded the program's 1981 maiden orbital flight, STS-1, and in 1983 commanded STS-9, which carried the first Spacelab module.	Ele comandou o voo orbital inaugural do programa em 1981, o STS-1, e em 1983 comandou o STS-9, que carregou o primeiro módulo do Spacelab.
In 1986 he was in line to make a record seventh space flight on STS-61-J to deploy the Hubble Space Telescope, but the Space Shuttle Challenger disaster earlier that year had delayed NASA's schedule.	Em 1986, ele estava prestes a fazer um sétimo voo espacial recorde no STS-61 para colocar o telescópio espacial Hubble em órbita, mas o desastre com o ônibus espacial Challanger no início do ano atrasou a programação da NASA.
Young was openly critical of NASA management following the Challenger disaster, and in April 1987 was made Special Assistant to JSC Director Aaron Cohen for Engineering, Operations and Safety.	Young criticou abertamente a gestão da NASA após o desastre com o Challanger e, em abril de 1987, ele foi nomeado assistente especial do diretor Aaron Cohen do JSC para engenharia, operações e segurança.
NASA denied that his criticism triggered the move, although Young and industry insiders believed that was the reason for the reassignment.	A NASA negou que suas críticas tenham desencadeado a mudança, embora Young e os integrantes do setor acreditaram que tenha sido essa a razão para a sua transferência de cargo.
In February 1996, he was assigned as Associate Director (Technical) JSC.	Em fevereiro de 1996, ele foi designado como diretor associado (técnico) do JSC.
During his NASA career, Young logged more than 15,000 hours of training, mostly in simulators, to prepare for positions on eleven spaceflights in prime and backup crew positions.	Durante sua carreira na NASA, Young registrou mais de 15.000 horas de treinamento, principalmente em simuladores, para se preparar para participar em onze voos espaciais em posições de tripulação principal e reserva.
Young worked for NASA for 42 years and announced his retirement on December 7, 2004.	Young trabalhou para a NASA durante 42 anos e anunciou sua aposentadoria no dia 7 de dezembro de 2004.
He retired on December 31, 2004, at the age of 74, but continued to attend the Monday Morning Meeting at the Astronaut Office at JSC for several years thereafter.	Ele se aposentou no dia 31 de dezembro de 2004, aos 74 anos, mas seguiu participando das reuniões matinais às segundas-feiras no escritório dos astronautas do JSC por vários anos após isso.
He logged more than 15,275 hours flying time in props, jets, helicopters, and rocket jets; more than 9,200 hours in T-38s; and 835 hours in spacecraft during six space flights.	Ele registrou mais de 15.275 horas de voo em protótipos, jatos, helicópteros e foguetes; mais de 9.200 horas em T-38s; e 835 horas em espaçonaves durante seis voos espaciais.
On April 12, 2006, Young appeared at the 25th anniversary of the STS-1 launch at the Kennedy Space Center Visitor Complex, along with pilot Robert Crippen.	No dia 12 de abril de 2006, Young apareceu no 25º aniversário do lançamento do STS-1 no Kennedy Space Center Visitor Complex, com o piloto Robert Crippen.
The two spoke of their experiences during the flight.	Os dois falaram sobre suas experiências durante o voo.
In 2012, Young published an autobiography, Forever Young.	Em 2012, Young publicou uma autobiografia, intitulada Forever Young.
Young married Barbara White of Savannah, Georgia, and they had two children, Sandra and John.	Young casou-se com Barbara White, de Savannah, na Geórgia, e eles tiveram dois filhos, Sandra e John.
They were divorced in 1972 after 16 years of marriage.	Eles se divorciaram em 1972, após 16 anos de casamento.
He later married Susy Feldman, and lived in El Lago, Texas, a suburb of Houston.	Mais tarde, ele casou-se com Susy Feldman e foi morar em El Lago, no Texas, um subúrbio de Houston.
Young died on January 5, 2018, at his home in Houston of complications from pneumonia.	Young morreu no dia 5 de janeiro de 2018, em sua casa em Houston, de complicações causadas por pneumonia.
He was 87.	Ele tinha 87 anos.
Abbotsford Bridge is a steel Allan truss bridge that is about 240 m (790 ft) in length.	A Abbotsford Bridge é uma ponte treliça de aço com cerca de 240 metros (790 pés) de comprimentos.
The bridge also contains a single lift span about 20 m (66 ft) in length, which is still in working order.	A ponte também contém um único vão de elevação com cerca de 20 metros (66 pés) de comprimento, que ainda está em funcionamento.
It is two lanes wide through most of its length, but the lift span is only capable of carrying a single lane.	Tem duas faixas de largura na maior parte de seu comprimento, mas o vão de elevação só é capaz de transportar uma única faixa.
The entire bridge has been marked with a single lane and has traffic lights on both ends to control vehicular flow.	Toda a ponte foi marcada com uma única faixa e ela possui semáforos nas duas pontas para controlar o fluxo de veículos.
The bridge was completed in 1928 by the NSW Department of Public Works and, although opened as a traffic bridge, it was designed to carry the loads required for a railway, once the Mildura railway line had been extended over the bridge.	A ponte foi concluída em 1928 pelo Departamento de Obras Públicas de NSW e, embora tenha sido inaugurada como uma ponte de tráfego, foi projetada para transportar as cargas necessárias para uma ferrovia, uma vez que a linha ferroviária de Mildura se estendesse sobre ela.
The line was never extended beyond Yelta, where the terminus remains to this day.	A linha nunca foi estendida além de Yelta, onde o terminal está até hoje.
The location of the bridge was thought to be convenient, as it provided a link to the Sturt Highway without travelling farther upstream to Mildura.	A localização da ponte foi considerada conveniente, pois fornecia uma ligação à rodovia Sturt sem que fosse preciso viajar rio acima até Mildura.
It is the only remaining steel truss bridge with a lift span on the Murray, although other lifting bridges still exist along the river.	É a única ponte de treliça de aço com vão de elevação remanescente sobre o Murray, embora ainda existam outras pontes elevatórias ao longo do rio.
The bridge was built after the decline in commercial river traffic on the Murray.	A ponte foi construída após o declínio do tráfego comercial no rio Murray.
Due to its significance to the local area, it has been listed on the NSW State Heritage Register.	Devido à sua importância para a área local, foi listada no Registro do Patrimônio Estadual de NSW.
The nearby town of Wentworth was an important river port from which wool was shipped to the coast, and as such there was a variety of traffic in the area.	A cidade vizinha Wentworth era um importante porto fluvial de onde a lã era enviada para a costa, por isso havia uma variedade de tráfego na área.
In the 1890s, irrigated farming greatly expanded in Sunraysia region which is known for its fruit production, and traffic volumes increased further.	Na década de 1890, a agricultura irrigada aumentou muito na região de Sunraysia, famosa por sua produção de frutas, e os volumes de tráfego aumentaram ainda mais.
It was decided to install a punt at this location (then known as Abbot's Ford).	Decidiu-se instalar uma balsa conduzida por cabo neste local (então conhecido como Abbot's Ford).
New South Wales and Victoria had signed an agreement towards constructing bridges for railways over the Murray to serve the settlements on the northern side.	New South Wales e Vitória assinaram um acordo para a construção de pontes para ferrovias sobre o Murray para servir aos assentamentos no lado norte do rio.
In 1923, a report was released that recommended going ahead with the building of four bridges, one of those being the future Abbotsford Bridge.	Em 1923, foi divulgado um relatório que recomendava avançar com a construção de quatro pontes, sendo uma delas a futura ponte Abbotsford.
It was said a bridge in this area would benefit Curlwaa, Wentworth, and a proposed irrigation scheme to the north.	Diz-se que uma ponte nessa área beneficiaria Curlwaa, Wentworth e um esquema de irrigação proposto ao norte.
The cost was estimated at £78,000.	O custo estimado era de £ 78.000.
It had been considered that it might be appropriate to combine these four bridges with locks, but this idea was rejected due to siting concerns.	Considerou-se que poderia ser apropriado combinar essas quatro pontes com eclusas, mas essa ideia foi rejeitada devido a questões de localização.
In 1924, residents of nearby settlements urged construction of the railway line to the proposed bridge site, but they were told this extension of the line was to be delayed.	Em 1924, os residentes em povoados próximos insistiram na construção da linha ferroviária para o local da ponte proposta, mas foram informados que essa extensão da linha seria adiada.
Within that year it was decided that a bridge was to be constructed due to increased traffic volume, and tenders were let for manufacture of the bridge spans, construction of abutments and piles, and transport of materials to the future construction site.	Nesse ano, decidiu-se que uma ponte seria construída devido ao aumento do volume de tráfego, e licitações foram realizadas para a fabricação dos vãos da ponte, a construção de pilares e estacas e o transporte de materiais para o futuro canteiro de obras.
Achebe expanded this criticism when he presented a Chancellor's Lecture at Amherst on 18 February 1975, 'An Image of Africa: Racism in Conrad's "Heart of Darkness"'.	Achebe expandiu esta crítica quando apresentou a palestra do chanceler em Amherst no dia 18 de fevereiro de 1975, “Uma imagem da África: racismo em 'Coração das Trevas' de Conrad”.
Decrying Joseph Conrad as "a bloody racist", Achebe asserted that Conrad's famous novel dehumanises Africans, rendering Africa as "a metaphysical battlefield devoid of all recognisable humanity, into which the wandering European enters at his peril."	Descrevendo Joseph Conrad como um “racista maldito”, Achebe afirmou que o famoso romance de Conrad desumaniza os africanos tornando a África “um campo de batalha metafísico desprovido de toda a humanidade reconhecível, no qual o errante europeu entra por sua conta e risco”.
Achebe also discussed a quotation from Albert Schweitzer, a 1952 Nobel Peace Prize laureate: "That extraordinary missionary, Albert Schweitzer, who sacrificed brilliant careers in music and theology in Europe for a life of service to Africans in much the same area as Conrad writes about, epitomizes the ambivalence.	Achebe também debateu uma citação de Albert Schweitzer, ganhador do Prêmio Nobel da Paz em 1952: “aquele missionário extraordinário, Albert Schweitzer, que sacrificou carreiras brilhantes na música e na teologia na Europa por uma vida de serviço aos africanos, praticamente na mesma área que Conrad escreve sobre, resume a ambivalência.
In a comment which has often been quoted Schweitzer says: 'The African is indeed my brother but my junior brother.' And so he proceeded to build a hospital appropriate to the needs of junior brothers with standards of hygiene reminiscent of medical practice in the days before the germ theory of disease came into being." Some were surprised that Achebe would challenge a man honoured in the West for his "reverence for life".	Em um comentário frequentemente citado, Schweitzer diz: 'o africano é realmente meu irmão, mas meu irmão caçula.' E então ele começou a construir um hospital apropriado às necessidades dos seus irmãos caçulas, com padrões de higiene que lembram a prática médica anterior ao surgimento da teoria dos germes sobre as doenças.” Algumas pessoas ficaram surpresas que Achebe desafiasse um homem homenageado no ocidente por sua “reverência pela vida”.
The lecture caused a storm of controversy, even at the reception immediately following his talk.	A palestra causou uma tempestade polêmica, inclusive na recepção imediatamente seguida de sua fala.
