A stormwater management system and native planting were utilized on the building's exterior.	Um sistema de gerenciamento de águas pluviais e plantios nativos foi empregado no exterior do edifício.
The library once again incorporated materials from Mankato Kasota Stone, making the difference between the old and new exterior surfaces virtually indistinguishable.	A biblioteca mais uma vez incorporou materiais da Mankato Kasota Stone, tornando a diferença entre as superfícies externas antigas e novas praticamente indistinguível.
The teen section was significantly expanded and a new ground-floor meeting room was built.	A seção juvenil foi significativamente ampliada e uma nova sala de reuniões foi construída no térreo.
The children's section was also subject to improvements, gaining new nature-inspired design elements including bird light fixtures.	A ala infantil também passou por melhorias, ganhando novos componentes de design inspirados na natureza, como luminárias de pássaros.
Orthogenesis, also known as orthogenetic evolution, progressive evolution, evolutionary progress, or progressionism, is the biological hypothesis that organisms have an innate tendency to evolve in a definite direction towards some goal (teleology) due to some internal mechanism or "driving force".	A ortogênese, também conhecida como evolução ortogenética, evolução progressiva, progresso evolutivo ou progressismo, é a hipótese biológica de que os organismos têm uma tendência inata de evoluir em uma direção definida rumo a algum objetivo (teleologia) devido a algum mecanismo interno ou “força motriz”.
According to the theory, the largest-scale trends in evolution have an absolute goal such as increasing biological complexity.	Segundo a teoria, as tendências de maior grandeza na evolução têm um objetivo absoluto, como aumentar a complexidade biológica.
Prominent historical figures who have championed some form of evolutionary progress include Jean-Baptiste Lamarck, Pierre Teilhard de Chardin, and Henri Bergson.	Entre as figuras históricas destacadas que defenderam alguma forma de progresso evolutivo estão Jean-Baptiste Lamarck, Pierre Teilhard de Chardin e Henri Bergson.
The term orthogenesis was introduced by Wilhelm Haacke in 1893 and popularized by Theodor Eimer five years later.	O termo ortogênese foi introduzido por Wilhelm Haacke em 1893 e popularizado por Theodor Eimer cinco anos mais tarde.
Proponents of orthogenesis had rejected the theory of natural selection as the organizing mechanism in evolution for a rectilinear model of directed evolution.	Os proponentes da ortogênese haviam rejeitado a teoria da seleção natural como o mecanismo organizador da evolução em prol de um modelo direto de evolução determinada.
With the emergence of the modern synthesis, in which genetics was integrated with evolution, orthogenesis and other alternatives to Darwinism were largely abandoned by biologists, but the notion that evolution represents progress is still widely shared.	Com o nascimento da síntese moderna, na qual a genética foi integrada à evolução, a ortogênese e outras opções ao darwinismo foram amplamente abandonadas pelos biólogos, mas a noção de que a evolução representa o progresso ainda é extensamente compartilhada.
The evolutionary biologist Ernst Mayr made the term effectively taboo in the journal Nature in 1948, by stating that it implied "some supernatural force".	O biólogo evolucionista Ernst Mayr tornou o termo efetivamente tabu na revista Nature em 1948, afirmando que implicava “alguma força sobrenatural”.
The American paleontologist George Gaylord Simpson (1953) attacked orthogenesis, linking it with vitalism by describing it as "the mysterious inner force".	O paleontólogo americano George Gaylord Simpson (1953) atacou a ortogênese, ligando-a ao vitalismo, descrevendo-a como “a misteriosa força interior”.
Modern supporters include E. O.	Os defensores modernos incluem E. O.
Wilson and Simon Conway Morris, while museum displays and textbook illustrations continue to give the impression of progress in evolution.	Wilson e Simon Conway Morris, enquanto as exibições de museus e ilustrações de livros didáticos continuam a dar a impressão de progresso na evolução.
The philosopher of biology Michael Ruse notes that in popular culture evolution and progress are synonyms, while the unintentionally misleading image of the March of Progress, from apes to modern humans, has been widely imitated.	O filósofo da biologia Michael Ruse considera que na cultura popular evolução e progresso são sinônimos, enquanto a imagem involuntariamente enganosa da Marcha do Progresso, dos macacos aos humanos modernos, foi extensamente imitada.
The term orthogenesis (from Ancient Greek ὀρθός orthós, "straight", and γένεσις génesis, "origin") was first used by the biologist Wilhelm Haacke in 1893.	O termo ortogênese (do grego antigo ὀρθός orthós, “reto”, e γένεσις génesis, “origem”) foi usado pela primeira vez pelo biólogo Wilhelm Haacke em 1893.
Theodor Eimer was the first to give the word a definition; he defined orthogenesis as "the general law according to which evolutionary development takes place in a noticeable direction, above all in specialized groups".	Theodor Eimer foi o primeiro a dar uma definição à palavra; ele definiu a ortogênese como “a lei geral segundo a qual o desenvolvimento evolutivo ocorre em uma direção perceptível, sobretudo em grupos especializados”.
In 1922, the zoologist Michael F. Guyer wrote:	Em 1922, o zoologista Michael F. Guyer escreveu:
[Orthogenesis] has meant many different things to many different people, ranging from a mystical inner perfecting principle, to merely a general trend in development due to the natural constitutional restrictions of the germinal materials, or to the physical limitations imposed by a narrow environment.	[A ortogênese] significou muitas coisas diferentes para muitas pessoas diferentes, variando de um princípio místico interior de aperfeiçoamento a meramente uma tendência geral de desenvolvimento, devido às restrições constitucionais naturais dos materiais germinativos ou às limitações físicas impostas por um ambiente restritivo.
In most modern statements of the theory, the idea of continuous and progressive change in one or more characters, due according to some to internal factors, according to others to external causes-evolution in a "straight line" seems to be the central idea.	Na maioria dos conceitos modernos sobre a teoria, a ideia de mudança contínua e progressiva em um ou mais caracteres, de acordo com alguns devido a fatores internos, segundo outros devido à evolução de causas externas em “linha reta” parece ser a ideia central.
According to Susan R. Schrepfer in 1983:	Segundo Susan R. Schrepfer em 1983:
Orthogenesis meant literally "straight origins", or "straight line evolution".	ortogênese significava literalmente “origens retas” ou “evolução em linha reta”.
The term varied in meaning from the overtly vitalistic and theological to the mechanical.	O termo alternava em significado do ostensivamente vitalista e teológico ao mecânico.
It ranged from theories of mystical forces to mere descriptions of a general trend in development due to natural limitations of either the germinal material or the environment ...	Ele variou de teorias de forças místicas a meras descrições de uma tendência geral em desenvolvimento devido a limitações naturais do material germinativo ou do ambiente…
Few details are known about Smart's time at St Luke's Hospital for Lunatics.	Poucos detalhes são conhecidos sobre o tempo de Smart no St Luke's Hospital for Lunatics.
He was admitted to St Luke's on 6 May 1757 as a "Curable Patient".	Ele foi admitido no St Luke no dia 6 de maio de 1757 como um “paciente curável”.
It is possible that Smart was confined at Newbery's behest over old debts and a poor relationship that existed between the two; Newbery had previously mocked Smart's immorality in A Collection of Pretty Poems for the Amusement of Children six Foot High.	Pode ser que Smart tenha sido confinado por ordem de Newbery devido a dívidas antigas e um relacionamento ruim que existia entre os dois; Newbery já havia debochado da imoralidade de Smart em A Collection of Pretty Poems for the Amusement of Children six Foot High.
Regardless of Newbery's exact reasons, there is evidence suggesting that Newbery's admittance of Smart into the mental asylum was not based on madness.	Independentemente das razões exatas de Newbery, há evidências sugerindo que o internamento de Smart por Newbery no asilo mental não foi baseado em loucura.
To have Smart admitted, Newbery probably provided a small bribe, although bribes were against St Luke's policy.	Para internar Smart, Newbery provavelmente forneceu um pequeno suborno, embora os subornos fossem contra a política de St Luke's.
There is little information about Smart's condition during his stay at St Luke's, possibly because Battie's denied his patients from being visited, including by their own family members.	Há pouca informação sobre a condição de Smart durante seu internamento no St Luke's, possivelmente porque Battie negou que seus pacientes fossem visitados, inclusive pelos seus próprios familiares.
One of the few records that survive of Smart's time at St Luke's was an entry in St Luke's Minute Book, which read:	Um dos poucos registros que sobrevivem do tempo de Smart no St Luke's foi uma entrada no livro de registros do St Luke's, que dizia:
12 May 1758	12 de maio de 1758
Dr. Battie having acquainted this Committee that Christopher Smart (who was admitted on the 6th day of May 1757) continues disordered in his Senses notwithstanding he has been admitted into this Hospital above 12 Calendar Months and from the present Circumstances of his Case there is not Suffit.	Tendo Dr. Battie informado a este Comitê que Christopher Smart (que foi internado no dia 6 de maio de 1757) continua fora dos seus sentidos, apesar de ter sido internado neste hospital há mais de 12 meses e das presentes circunstâncias de seu caso, não há suficientes
reason to expect his speedy Recovery And he being brought up and examined.	razões para esperar sua rápida recuperação e que ele seja acordado e examinado.
Ordered.	Ordenado.
That he be discharged and that Notice be sent to his Securities to take him away.	Que ele receba alta e esse aviso seja enviado aos seus responsáveis para o levarem embora.
During Smart's confinement at St Luke's, not even other doctors were allowed to see Smart unless they had received personal permission from Battie.	Durante o confinamento de Smart no St Luke's, nem mesmo outros médicos foram autorizados a vê-lo, a menos que tivessem recebido permissão pessoal de Battie.
It was improbable that Smart could have left the asylum without being released by Battie.	Era improvável que Smart pudesse ter saído do asilo sem ser autorizado por Battie.
Even if Smart would have attempted to obtain release via legal means, the rules for subpoenaing release would have been almost impossible to follow based on the system that Battie had in place, which isolated the individual from all contact.	Mesmo que Smart tentasse obter liberação legalmente, as regras para intimar a liberação teriam sido quase impossíveis de seguir com base no sistema que Battie tinha estabelecido, que isolava a pessoa de qualquer contato.
Eventually, Smart was deemed "incurable" and would not have been released by the hospital but for its lack of funds.	Eventualmente, Smart foi considerado “incurável” e não teria tido alta do hospital se não fosse por falta de fundos.
There is little information about how and why Smart was released from asylum, but his daughter claimed: "He grew better, and some misjudging friends who misconstrued Mr Newbery's great kindness in placing him under necessary & salutary restriction which might possibly have eventually wrought a cure, invited him to dinner and he returned to his confinement no more." What is known about the actual events is that John Sherratt, Christopher Smart's friend, believed that Smart's confinement was unfair and wanted to negotiate Smart's release.	Há pouca informação sobre como e por que Smart teve alta do asilo, mas sua filha afirmou: “ele melhorou, e alguns amigos mal-intencionados que interpretaram mal a grande bondade do Sr. Newbery em colocá-lo sob restrições necessárias e salutares, que poderiam ter eventualmente causado uma cura, convidaram-no para jantar e ele não voltou mais ao seu internamento.” O que se sabe sobre os eventos reais é que John Sherratt, amigo de Christopher Smart, acreditava que o internamento de Smart era injusto e queria negociar sua alta.
In January 1763, he met with a parliamentary committee to discuss the issue of individuals falsely imprisoned and abuses that they would receive in asylums.	Em janeiro de 1763, ele se reuniu com uma comissão parlamentar para discutir a questão de indivíduos falsamente presos e os abusos que receberiam em asilos.
In particular, Sherratt argued that many were admitted for habitual intoxication, which undermined Battie's and other asylum keeper's reputations.	Em particular, Sherratt alegou que muitos foram internados por intoxicação habitual, o que prejudicou a reputação de Battie e de outros mantenedores de asilo.
A finding by the parliamentary committee released 27 January 1763 bolstered Sherratt's chances to release Smart.	Uma descoberta da comissão parlamentar divulgada no dia 27 de janeiro de 1763 reforçou as chances de Sherratt para dar alta a Smart.
Carl Michael Bellman is the central figure in Swedish song, known for his 1790 Fredman's Epistles and his 1791 Fredman's Songs.	Carl Michael Bellman é a figura central da canção sueca, conhecido por suas Epístolas de Fredman de 1790 e suas Canções de Fredman de 1791.
He played the cittern, accompanying himself as he performed his songs at the royal court.	Ele tocava a cítara, como seu acompanhamento enquanto cantava suas músicas na corte real.
Jean Fredman is a fictional character and the supposed narrator in Bellman's epistles and songs, based on a real watchmaker of Bellman's Stockholm.	Jean Fredman é um personagem hipotético e o suposto narrador nas epístolas e canções de Bellman, baseado em um relojoeiro real da Estocolmo de Bellman.
The epistles paint a picture of the demimonde life of the city during the eighteenth century, where strong drink and beautiful "nymphs" like Ulla Winblad create a rococo picture of life, blending classical allusion and pastoral description with harsh reality.	As epístolas pintam um retrato da vida mundana da cidade durante o século XVIII, onde bebidas fortes e belas “ninfas” como Ulla Winblad criam uma imagem rococó da vida, misturando alusão clássica e descrição pastoral com a dura realidade.
Epistle 82 has been recorded by Fred Åkerström, where it forms the title track of his third album of Bellman interpretations, as well as by Sven-Bertil Taube.	A Epístola 82 foi gravada por Fred Åkerström, onde forma a faixa-título de seu terceiro álbum de interpretações de Bellman, bem como por Sven-Bertil Taube.
It has been translated into English by Eva Toller.	Foi traduzida para o inglês por Eva Toller.
The song has featured in at least 16 Swedish films from 1929 onwards.	A música foi incluída em pelo menos 16 filmes suecos de 1929 em diante.
Lars Lönnroth, writing in Svenska Dagbladet, suggests that the "spring" in the Epistle was in fact not a stream in summer meadows but a fashionable spa, perhaps Djurgårsbrunn on what was in Bellman's time the edge of Stockholm.	Lars Lönnroth, escrevendo para o Svenska Dagbladet, sugere que a “primavera” na Epístola não era de fato um riacho nos prados de verão, mas um spa moderno, talvez Djurgårsbrunn no que na época de Bellman era a fronteira de Estocolmo.
Henrik Mickos, in the 2011 Bellman lecture, discussed what the "pimpinella" of the first verse might be, concluding that salad burnet (Sanguisorba minor) was quite likely, given it was known at the time as pimpinella, and was more common in Sweden then than it is now.	Henrik Mickos, na palestra sobre Bellman em 2011, discutiu o que poderia ser a “pimpinella” do primeiro verso, concluindo que o salad burnet (Sanguisorba minor) era bastante provável, já que era conhecido na época como pimpinella, e era mais comum na Suécia então do que é agora.
Mickos dismisses the possibility that it was aniseed (Pimpinella anisum), which was used to flavour brännvin but not as the song has it ("red wine and pimpinella") a wine-based punch.	Mickos descarta a possibilidade de que fosse anis (Pimpinella anisum), que era usado para dar sabor ao brännvin, mas não como a música descreve (“vinho tinto e pimpinella”), um ponche à base de vinho.
Writing for The Boston Globe, Michael Andor Brodeur argued that while the show may feel like an advertisement for emoji, "the most satisfying part is watching self-proclaimed enthusiasts of the form stumble through their symbols once the difficulty is ever-so-slightly notched up....watching so much get lost in translation feels like a win.	Escrevendo para o The Boston Globe, Michael Andor Brodeur argumentou que, embora o programa possa parecer um anúncio de emoji, “a parte mais satisfatória é assistir aos autoproclamados entusiastas do formato tropeçarem em seus símbolos, uma vez que a dificuldade é ligeiramente aumentada… Ver tanta coisa se perder na tradução é satisfatório.
In terms of ratings, the series' first two episodes debuted to 336,000 and 322,000 respective viewers, with a 0.10 and 0.09 18–49 rating respectively.	Em termos de classificações, os dois primeiros episódios da série estrearam respectivamente para 336.000 e 322.000 espectadores, com uma classificação de 0,10 e 0,09 respectivamente, dos 18 aos 49 anos.
The episode followed up on the plot introduced in the final instalment of the second season in which a probe from an unknown alien race attacks Earth.	O episódio seguiu o enredo introduzido na parte final da segunda temporada em que uma sonda de raça alienígena desconhecida ataca a Terra.
A number of new sets and costumes were required, with preparations beginning for some departments up to three weeks before filming began.	Alguns cenários e figurinos novos foram necessários, com os preparativos começando para alguns departamentos até três semanas antes do início das filmagens.
One change which was made was a new outfit for T'Pol, with costume tests taking place a week before filming began.	Uma mudança que foi introduzida foi uma nova roupa para T'Pol, com testes de figurino ocorrendo uma semana antes do início das filmagens.
The redesign was because of studio executives wanting the show to appeal more to the 18–49 male demographic.	O novo design foi por causa dos executivos do estúdio que queriam que o programa apelasse mais para o público masculino de 18 a 49 anos.
The production team looked to the mid-series boost that the introduction of Seven of Nine provided on Star Trek: Voyager and sought for Enterprise to appeal to that demographic in the same manner.	A equipe de produção olhou para o impulso no meio da série que a introdução de Seven of Nine ofereceu para Star Trek: Voyager e procurou que Enterprise atraísse esse público da mesma maneira.
Kate O'Hara of New York Magazine later joked in reference to the change, "Women of the future will certainly choose to wear tight, uncomfortable, skin-tight catsuits!"	Kate O'Hara, da New York Magazine, brincou mais tarde em referência à mudança: “as mulheres do futuro certamente escolherão usar macacões apertados, desconfortáveis e justos!”
"The Xindi" was seen as a new pilot by executive producers Brannon Braga and Rick Berman, who also wrote the episode.	“Os Xindi” foi visto como um novo piloto pelos produtores executivos Brannon Braga e Rick Berman, que também escreveu o episódio.
Braga said "We were re-establishing an Enterprise that was going to be a little bit different this year, so we had to think of it in those terms." They felt the best way to do this was to immediately reveal the Xindi to the audience, and to give the MACOs something to do in order to introduce them as well.	Braga disse: “estávamos restabelecendo uma Enterprise que seria um pouco diferente este ano, etão tivemos que pensar nisso nesses termos.” Eles sentiram que a melhor maneira de fazer isso era revelar imediatamente os Xindi ao público e dar aos MACOs algo para apresentá-los também.
He called it a "big episode" as they sought to set up the rest of season.	Ele chamou a isso “grande episódio” enquanto eles tentaram definir o resto da temporada.
The shoot began on June 26, 2003, with the expectation that it would take nine days (as opposed to the usual seven) to complete.	As filmagens começaram dia 26 de junho de 2003, com a expectativa de que levariam nove dias (em oposição aos sete habituais) para serem concluídas.
One of the special effects on the episode used ground Styrofoam which had been painted blue and processed through a wood chipper.	Um dos efeitos especiais do episódio empregou isopor moído que foi pintado de azul e processado por meio de um picador de madeira.
It was used to represent the mineral Trellium-D within the mine.	Ele foi utilizado para simbolizar o mineral Trellium-D dentro da mina.
However, the ground Styrofoam stuck to the actors' shoes and costumes and ended up being spread throughout the Paramount lot where the series was filmed.	Contudo, o isopor no chão grudou nos sapatos e figurinos dos atores e acabou se espalhando por todo o lado de Paramount onde a série foi filmada.
It would turn up in unexpected places on set for the rest of the series, and was found in among the sets as they were being dismantled after the end of season four.	Apareceria em alguns lugares inesperados no set durante o resto da série, e foi encontrado entre os sets enquanto eles estavam sendo desmontados após o final da quarta temporada.
"The Xindi" featured several actors who would go on to recur in their roles throughout the third season of Enterprise.	“Os Xindi” contou com vários atores que se repetiriam em seus papéis ao longo da terceira temporada de Enterprise.
These included the MACO marines under the command of Major Hayes, played by Steven Culp.	Eles incluíam os fuzileiros navais MACO comandados pelo Major Hayes, interpretado por Steven Culp.
At the time of his appearance in "The Xindi", he felt that he did not have any characterisation to work with.	Na época de sua aparição em “Os Xindi”, ele sentiu que não tinha nenhuma caracterização para trabalhar.
During the production of his second episode, "The Shipment", Culp read an article in the Los Angeles Times about a troubled youth who joined the military and in serving in the Iraq War had found himself.	Durante a produção de seu segundo episódio, “O Carregamento”, Culp leu um artigo nos Los Angeles Times sobre um jovem problemático que se juntou ao exército e ao servir na Guerra do Iraque se encontrou.
After discussing it with the director, this became the basis for the character.	Após discutir com o diretor, isso se tornou a base para o seu personagem.
Daniel Dae Kim made his first of three appearances in "The Xindi" as Corporal Chang; he had previously appeared as Gotana-Retz in the Voyager episode "Blink of an Eye".	Daniel Dae Kim fez sua primeira de três aparições em “Os Xindi” como Cabo Chang; ele já havia aparecido como Gotana-Retz no episódio “Num Piscar de Olhos” da Voyager.
The band were afforded more time to record than previous endeavors, and were listening to music such as Jawbreaker, Bad Religion and Lagwagon, which influenced the album.	A banda teve mais tempo para gravar do que as iniciativas anteriores, e estava ouvindo músicas como Jawbreaker, Bad Religion e Lagwagon, que influenciaram o álbum.
For production duties, the band worked with Mark Trombino, who provided additional piano and keyboards on Dude Ranch.	Para tarefas de produção, a banda trabalhou com Mark Trombino, que forneceu piano e teclados adicionais em Dude Ranch.
The trio picked him based on his work he had done on Jimmy Eat World's Static Prevails (1996). The group spent time trying to amuse Trombino, to no avail.	O trio o escolheu com base no trabalho que ele havia feito em Static Prevails de Jimmy Eat World (1996). O grupo passou um tempo tentando impressionar Trombino, sem sucesso.
Hoppus' sister, Anne Hoppus, described Trombino as very quiet during the sessions.	A irmã de Hoppus, Anne Hoppus, retratou Trombino como muito calado nas sessões.
Trombino, in a retrospective piece about the album, mentioned that he was "excited, but also nervous and intimidated.	Trombino, em uma retrospectiva sobre o álbum, mencionou que estava “animado, mas também nervoso e intimidado.
I felt weird that there were these guys who had sold way more records than I had ever sold and I'm sitting in the producer’s chair telling them what to do." Dude Ranch was recorded Big Fish Studios in Rancho Santa Fe, California in December 1996.	Eu me senti estranho que havia esses caras que venderiam muito mais discos do que eu já vendera e estou sentado na cadeira do produtor dizendo-lhes o que fazer.” Dude Ranch foi gravado no Big Fish Studios em Rancho Santa Fe, Califórnia, em dezembro de 1996.
Big Fish was a converted guesthouse which had just survived a wildfire months before.	Big Fish era uma pousada reformada que acabara de resistir a um incêndio florestal meses antes.
